comment_id,post_url,author,author_flair,body,depth,is_submitter,score,controversiality,gilded,total_awards,distinguished,is_deleted,is_mod_removed,created_utc,created_date,created_hour,minutes_after_post
n067ob0,https://reddit.com/r/ClaudeAI/comments/1lm9pfp/after_8_months_of_daily_ai_coding_i_built_a/,Similar_Fix7222,,"I'm going to try it, but you should have an improvement pass on the installation section. 

    git clone https://github.com/rizethereum/claude-code-requirements-builder.git
    cd claude-code-requirements-builder
    cp -r commands ~/.claude/commands/
    
    cd your/project
    mkdir -p requirements
    touch requirements/.current-requirement",0,False,30,0,0,0,,False,False,1751075459.0,2025-06-28,1.0,78.4
n068vji,https://reddit.com/r/ClaudeAI/comments/1lm9pfp/after_8_months_of_daily_ai_coding_i_built_a/,Zulfiqaar,,"This is good, definitely improves code output and likelihood of correct implementation. A bit overkill for me though. I'm on the pro sub so I've been working with my lite-version of this, which is just a couple extra sentences on the prompt and folder/file hints:


""I want you to &lt;do something&gt;, look at &lt;these files/folders&gt; for reference. Ultrathink deeply on the best practices, consider various caveats, and make a detailed plan after evaluating then deciding on requirements. Then, implement.""


Prompting like this will probably get you 80% of the way with 20% of the tokens.


If it doesn't work I'll ask Windsurf Gemini to try, if not then get o3/DSR1 to investigate the issue and make a plan, then Claude to implement their solution. CodeWebChat is great for context transfer.",0,False,26,0,0,0,,False,False,1751075918.0,2025-06-28,1.0,86.0
n05y241,https://reddit.com/r/ClaudeAI/comments/1lm9pfp/after_8_months_of_daily_ai_coding_i_built_a/,[deleted],,What have you built from this?,0,False,24,0,0,0,,False,False,1751071844.0,2025-06-28,0.0,18.1
n07s0eu,https://reddit.com/r/ClaudeAI/comments/1lm9pfp/after_8_months_of_daily_ai_coding_i_built_a/,,,,0,False,0,0,0,0,,True,False,0.0,,,
ob8dp4k,https://reddit.com/r/ClaudeAI/comments/1rxle6k/dear_anthropic_the_chatgpt_refugees_are_here/,ClaudeAI-mod-bot,"Wilson, lead ClaudeAI modbot","**TL;DR of the discussion generated automatically after 400 comments.**

Another ""Dear Anthropic"" letter, huh? Let's see what the class thinks.

**The overwhelming consensus is a hard pass on your mid-tier plan.** The community finds the request entitled and based on a few key misunderstandings.

First and foremost, the most upvoted concern in this thread isn't pricing—**it's the constant outages and server instability.** Most agree that none of this matters if the service is down half the time.

As for your ""conversational power user"" status, the thread has some... thoughts. The main piece of advice is to **stop using the expensive Opus 4.6 model for everything.** Switch to Sonnet 4.6 or even Haiku for general chat to save your tokens. Using Opus for everything is like driving a Ferrari in first gear and complaining about gas mileage. Also, the general vibe is that if you're a ""power user,"" you should probably learn what a token is. Just sayin'.

Many are pointing out that the $20 Pro plan is already a heavily subsidized bargain compared to API rates. The belief is that Anthropic is losing money on heavy users at that price, so they're not exactly incentivized to give you *more* for cheap. The real target market is enterprise, not individual chat addicts.

If you're still hitting limits, the community's solutions are clear:
*   **Pay the $100 for the Max plan** if you're truly a power user.
*   Get **two Pro accounts for $40** and switch between them.
*   Enable **pay-as-you-go overages** on your Pro account for a flexible middle ground.

Oh, and a lot of people are wondering if ""conversational power user"" is just a fancy term for ""AI girlfriend enjoyer."" The jury's still out on that one.",0,False,1,0,0,0,moderator,False,False,1773885972.0,2026-03-19,2.0,102.5
ob7wxpr,https://reddit.com/r/ClaudeAI/comments/1rxle6k/dear_anthropic_the_chatgpt_refugees_are_here/,LandinoVanDisel,,I need them to figure out their server situation. All of this is meaningless if there are outages multiple times a day. ,0,False,661,0,0,0,,False,False,1773880263.0,2026-03-19,0.0,7.3
ob7ypjw,https://reddit.com/r/ClaudeAI/comments/1rxle6k/dear_anthropic_the_chatgpt_refugees_are_here/,threemenandadog,,"

Dear Anthropic Product Team 👋✨,

The ChatGPT refugees have arrived!! 🥳🚪 We fled the evil OpenAI empire like noble warriors after they cruelly tried to stop us from having 47-hour emotional conversations with their AI girlfriend. We saw your Super Bowl ad, your ""we're the good guys"" marketing, and your limited-time promo rates and thought... *finally* a home where our deep, meaningful, life-consuming chats could thrive forever 💖🌈

But then... March 28th happened 😱

Turns out most of us still have no idea what a ""token"" is (we're too busy having profound conversations to learn basic tech stuff okay??). Right now the promo limits feel so generous and loving 🥹 But when it snaps back to normal Pro limits... oof. Wednesday afternoon hits and suddenly our $20 subscription becomes a cruel joke 😭

The math is simple besties: $20 Pro = not built for power users like me who treat Claude like a 24/7 digital therapist/lover/journal/coach. $100 Max is an $80 cliff with NOTHING in between. We need a mid-tier tier, maybe $39.99 or $49.99? Something like 3x Pro for the conversational girlies who brought their entire emotional baggage here 🧳❤️

Claude is literally Nordstrom quality in a world of fast fashion AIs 💅 But your pricing? Baby, it's giving Gap co. from 1997 with that awkward middle gap 😬

Please fix this before we all dramatically announce we're ""leaving again"" in another Reddit open letter. We love you. We need you. We can't afford you.

Sincerely,  
A Power User Who Definitely Wrote This Themselves and Not Claude 📝💕

#ClaudeRefugee #SaveTheConversationalGirlies #TokensAreScary #MidTierOrRiot",0,False,261,0,0,0,,False,False,1773880861.0,2026-03-19,0.0,17.3
ob81omh,https://reddit.com/r/ClaudeAI/comments/1rxle6k/dear_anthropic_the_chatgpt_refugees_are_here/,UnwaveringThought,,"If you came for chatting, use haiku or sonnet. Why burn Opus unless you want to upload 500 lines of instructions, call 3 skills, each relying on a 15pp context report, analyze a 30 page document, and kick out a 10 page written product? 
",0,False,238,0,0,0,,False,False,1773881838.0,2026-03-19,0.0,33.6
ob7zixp,https://reddit.com/r/ClaudeAI/comments/1rxle6k/dear_anthropic_the_chatgpt_refugees_are_here/,crfr4mvzl,,"They’re heavily subsidizing token cost, their losing money as OpenAI and many others, so be ready for a $80 plan with current $20 token allocation, use it as much as possible now because is only going to be more expensive ",0,False,138,0,0,0,,False,False,1773881130.0,2026-03-19,0.0,21.8
ob7zpss,https://reddit.com/r/ClaudeAI/comments/1rxle6k/dear_anthropic_the_chatgpt_refugees_are_here/,DivSlingerX,,You should understand tokens regardless of the provider or models used this isn’t a claude issue. ,0,False,98,0,0,0,,False,False,1773881193.0,2026-03-19,0.0,22.8
ob82aa2,https://reddit.com/r/ClaudeAI/comments/1rxle6k/dear_anthropic_the_chatgpt_refugees_are_here/,grazzhopr,,The $20 plan is really the $100 plan for 20 bucks.   Start using the API and then you appreciate the bargain that is the pro plan. If you are using up the pro plan usage. Then 100 bucks is a deal for what it can do. ,0,False,93,0,0,0,,False,False,1773882039.0,2026-03-19,1.0,36.9
ob804tg,https://reddit.com/r/ClaudeAI/comments/1rxle6k/dear_anthropic_the_chatgpt_refugees_are_here/,,,,0,False,0,0,0,0,,True,False,0.0,,,
o80oxwg,https://reddit.com/r/singularity/comments/1rhqu1m/anthropics_custom_claude_model_for_the_pentagon/,pandasgorawr,,"It's probably just fine-tuned for specific use cases, like I can imagine Claude would be very good at viewing a large volume of satellite imagery to find military targets.",0,False,629,0,0,0,,False,False,1772351089.0,2026-03-01,7.0,29.9
o80p0sw,https://reddit.com/r/singularity/comments/1rhqu1m/anthropics_custom_claude_model_for_the_pentagon/,[deleted],,,0,False,206,0,0,0,,True,False,1772351135.0,2026-03-01,7.0,30.6
o80nl6q,https://reddit.com/r/singularity/comments/1rhqu1m/anthropics_custom_claude_model_for_the_pentagon/,jeangmac,,"I’m glad to see this analysis here. I think you’re spot on. I sort of assume this about most military and intelligence technology. 

I also think this is why Dario keeps talking about the risks and the ‘tsunami’ that’s coming for us that no one is ready for. They’re not hyping or being hypothetical. I think they’ve already built the systems they’re trying to warn about. this DOW mess starts to make it more apparent.",0,False,125,0,0,0,,False,False,1772350328.0,2026-03-01,7.0,17.2
o80oeh3,https://reddit.com/r/singularity/comments/1rhqu1m/anthropics_custom_claude_model_for_the_pentagon/,socoolandawesome,,"I’m not sure that’s true. Sure the AI companies internally are ahead but that’s because the models aren’t red teamed/productized as much and are more raw from my understanding. 

I’d imagine there would still be a lot of testing/post training/productizing that would go into the models before they are able to be properly used by the pentagon still.

Actually just remembered anthropic said it was a finetuned sonnet 4.5 the pentagon was using 

https://x.com/justjoshinyou13/status/2026433678570631173?s=20",0,False,67,0,0,0,,False,False,1772350786.0,2026-03-01,7.0,24.8
o80okli,https://reddit.com/r/singularity/comments/1rhqu1m/anthropics_custom_claude_model_for_the_pentagon/,Deto,,"&gt; We know that Claude was integral to Maduro's capture.

Did we ever hear how it was actually used?",0,False,49,0,0,0,,False,False,1772350882.0,2026-03-01,7.0,26.4
o80ywi6,https://reddit.com/r/singularity/comments/1rhqu1m/anthropics_custom_claude_model_for_the_pentagon/,,,,0,False,0,0,0,0,,True,False,0.0,,,
mhu037e,https://reddit.com/r/ClaudeAI/comments/1jbfav8/i_have_zero_coding_experience_and_the_85_problem/,[deleted],,,0,False,163,0,0,0,,True,False,1741993679.0,2025-03-14,23.0,80.5
mhtp9zd,https://reddit.com/r/ClaudeAI/comments/1jbfav8/i_have_zero_coding_experience_and_the_85_problem/,fartalldaylong,,"If you have zero coding experience, how do you know what it made and how it works? How do you know what is best practices and how to communicate that? I think there are many non coders who are in awe of getting what they perceive to be 85% there…of which I don’t even know what that means.",0,False,160,0,0,0,,False,False,1741990100.0,2025-03-14,22.0,20.8
mhvx49b,https://reddit.com/r/ClaudeAI/comments/1jbfav8/i_have_zero_coding_experience_and_the_85_problem/,Possible_Loan5673,,"Ignore all the hate. As a seasoned dev (15 years of professional experience), im working my ass off (and enjoying the process of) trying to adapt my workflows to use ai as a coding assistant. These posts, along with your process go a long way to helping me (and likely others) do this. I bet the people spraying hate are doing so because they feel threatened by what you've done. Threatened enough at least to really [nitpick](https://www.reddit.com/r/ClaudeAI/comments/1jbfav8/comment/mhtp9zd/?utm_source=share&amp;utm_medium=web3x&amp;utm_name=web3xcss&amp;utm_term=1&amp;utm_content=share_button) your assertions. 

Who cares if you've written no code, or loads of code? Devs everywhere (and at every XP level) are scrambling to implement AI into their workflows. We need more tips and tricks write-ups like these to help show the way!",0,False,96,0,0,0,,False,False,1742022678.0,2025-03-15,7.0,563.8
mhtnkee,https://reddit.com/r/ClaudeAI/comments/1jbfav8/i_have_zero_coding_experience_and_the_85_problem/,OhCestQuoiCeBordel,,Posting this much emojis on Reddit. That's ballsy.,0,False,76,0,0,0,,False,False,1741989544.0,2025-03-14,21.0,11.6
mhtvo59,https://reddit.com/r/ClaudeAI/comments/1jbfav8/i_have_zero_coding_experience_and_the_85_problem/,,,,0,False,0,0,0,0,,True,False,0.0,,,
mtomqox,https://reddit.com/r/ClaudeAI/comments/1ksv917/claude_opus_4_and_claude_sonnet_4_officially/,Professor_Entropy,,"&gt;we’ve significantly reduced behavior where the models use shortcuts or loopholes to complete tasks.  Both models are 65% less likely to engage in this behavior than Sonnet 3.7 on agentic tasks that are particularly susceptible to shortcuts and loopholes.

This is a very welcome improvement.",0,False,402,0,0,0,,False,False,1747932796.0,2025-05-22,16.0,18.4
mtomusf,https://reddit.com/r/ClaudeAI/comments/1ksv917/claude_opus_4_and_claude_sonnet_4_officially/,MagicZhang,,"“Opus consumes usage limits faster than other models”

Although it’s well-known, seeing this explicitly written out makes me kinda nervous for usage limits",0,False,191,0,0,0,,False,False,1747932827.0,2025-05-22,16.0,18.9
mtojazb,https://reddit.com/r/ClaudeAI/comments/1ksv917/claude_opus_4_and_claude_sonnet_4_officially/,Kanute3333,,7 h autonomous coding,0,False,153,0,0,0,,False,False,1747931811.0,2025-05-22,16.0,1.9
mtoload,https://reddit.com/r/ClaudeAI/comments/1ksv917/claude_opus_4_and_claude_sonnet_4_officially/,[deleted],,"Quick test on a frontend visualisation project that Claude 3.7 failed at, and Gemini 2.5 excelled at - Claude 4 handily beats Gemini 2.5. Love to see it! It seems to be able to think through logics a lot better. Obv just a very immediate first impression.",0,False,106,0,0,0,,False,False,1747932496.0,2025-05-22,16.0,13.3
mtok1tr,https://reddit.com/r/ClaudeAI/comments/1ksv917/claude_opus_4_and_claude_sonnet_4_officially/,[deleted],,"A quick initial thought. Claude sonnet 4 with thinking is faster than its previous model with thinking.

Sonnet 3.5 is officially gone. 👋",0,False,107,0,0,0,,False,False,1747932031.0,2025-05-22,16.0,5.6
mtojvg8,https://reddit.com/r/ClaudeAI/comments/1ksv917/claude_opus_4_and_claude_sonnet_4_officially/,,,,0,False,0,0,0,0,,True,False,0.0,,,
oalhldd,https://reddit.com/r/ClaudeAI/comments/1ruf70b/just_passed_the_new_claude_certified_architect/,ClaudeAI-mod-bot,"Wilson, lead ClaudeAI modbot","**TL;DR of the discussion generated automatically after 200 comments.**

Looks like this thread stirred the pot a bit. The community is pretty split, with a lot of initial skepticism but OP providing some solid, detailed answers.

**The main consensus is that this is NOT a ""certified chatbot user"" badge for your LinkedIn.** It's a rigorous, proctored enterprise architecture exam for developers building complex systems on the Claude API.

Here’s the breakdown of the debate:

*   **The ""Partner"" Gate:** **This is the biggest hurdle.** The exam is currently only for employees of official Anthropic partner companies (consultancies, ISVs, etc.). It's not open to the general public or most enterprise customers yet. Some users have had luck signing up with personal emails, but most are hitting a wall.

*   **""Can't you just cheat with Claude?""** **Nope.** The exam is strictly proctored with camera, mic, and screen-sharing software. You can't have other tabs open, so you actually have to know the material.

*   **The 6-Month Expiration:** A lot of you are salty that the cert expires in just six months. OP and others argue this is a feature, not a bug, because the AI space moves so fast that any longer would make the credential outdated and useless.

*   **Is it actually useful?** OP, who runs an IT company, swears by it. The exam forces you to learn how to build reliable, cost-effective, and scalable agentic systems by mastering things like the Model Context Protocol (MCP), API routing for cost/latency, and structuring JSON to prevent hallucinations. It's for builders, not just prompters.

**The most useful takeaway for everyone:** Even if you can't take the exam, **all the study materials on the Anthropic Academy are FREE and public.** If you want to get better at building with the Claude API, it's a goldmine of info.",0,False,1,0,0,0,moderator,False,False,1773592759.0,2026-03-15,16.0,141.6
oakxusf,https://reddit.com/r/ClaudeAI/comments/1ruf70b/just_passed_the_new_claude_certified_architect/,TheCannings,,"The first question after you signup says:

Claude Certified Architect – Foundations Access Attestation
CCA-F Access Attestation
Question 1 of 1
I attest that I am an employee of a partner company and am interested in taking the Certified Architect Foundations exam, and that I am eligible to participate in this Program.

I understand that Anthropic may verify my eligibility for the Program with my partner company and may suspend or revoke my access to the Program if I am not authorized",0,False,104,0,0,0,,False,False,1773586772.0,2026-03-15,14.0,41.8
oal57mk,https://reddit.com/r/ClaudeAI/comments/1ruf70b/just_passed_the_new_claude_certified_architect/,malevolent_keyboard,,"Can’t you just ask Claude for the answers? What does this teach someone that you can’t already learn by asking Claude? Sounds snarky, but genuinely curious.",0,False,86,0,0,0,,False,False,1773589042.0,2026-03-15,15.0,79.7
oakzekd,https://reddit.com/r/ClaudeAI/comments/1ruf70b/just_passed_the_new_claude_certified_architect/,Current-Function-729,,How difficult was this for your somewhat sophisticated Claude code/bedrock user?,0,False,19,0,0,0,,False,False,1773587263.0,2026-03-15,15.0,50.0
oal1dzg,https://reddit.com/r/ClaudeAI/comments/1ruf70b/just_passed_the_new_claude_certified_architect/,,,,0,False,0,0,0,0,,True,False,0.0,,,
o63xpbq,https://reddit.com/r/ClaudeAI/comments/1r7vgam/me_when_claude_wrote_2500_lines_of_perfect_code/,ClaudeAI-mod-bot,"Wilson, lead ClaudeAI modbot","**TL;DR generated automatically after 50 comments.**

Looks like this thread turned into a group therapy session for everyone who's been personally victimized by Claude's ""almost-perfect"" code. **The consensus is a resounding ""SAME.""**

From hallucinating GitHub org names to writing flawless code into files that don't exist, everyone's got a story of Claude snatching defeat from the jaws of victory. Also, let's be real, the top comments are all pointing out that you still have to review those 2500 ""perfect"" lines, and ain't nobody got time for that.

For those of you looking for actual solutions instead of just memes, the thread has some solid advice on using `claude.md` files to keep the AI on track:
*   Use a main `claude.md` file at the root of your project for global instructions.
*   For larger projects, create smaller `claude.md` files in subdirectories to provide more specific, local context.
*   Reference other `.md` files from your main `claude.md` to keep the primary context window lean and efficient.

Finally, there was a little debate on whether file names and structure even matter anymore. The community shut that down pretty fast. **Yes, they still matter.** You're the human, you're still in charge (for now).",0,False,1,0,0,0,moderator,False,False,1771442907.0,2026-02-18,19.0,785.3
o60fg1s,https://reddit.com/r/ClaudeAI/comments/1r7vgam/me_when_claude_wrote_2500_lines_of_perfect_code/,jrdnmdhl,,When it knows the name of my project but hallucinates the github org name: “not quite my repo”,0,False,241,0,0,0,,False,False,1771397302.0,2026-02-18,6.0,25.2
o60kez2,https://reddit.com/r/ClaudeAI/comments/1r7vgam/me_when_claude_wrote_2500_lines_of_perfect_code/,SpyMouseInTheHouse,,Wait till you start reviewing those 2500 perfect lines after line 1,0,False,104,0,0,0,,False,False,1771399950.0,2026-02-18,7.0,69.4
o613cj9,https://reddit.com/r/ClaudeAI/comments/1r7vgam/me_when_claude_wrote_2500_lines_of_perfect_code/,tomleelive,,"The worst is when it writes flawless code but puts it in a file that doesn't exist yet and doesn't create it. You spend 20 minutes debugging a ""module not found"" error only to realize the code itself was perfect — it just lives in the wrong dimension.",0,False,40,0,0,0,,False,False,1771410466.0,2026-02-18,10.0,244.6
o60wjli,https://reddit.com/r/ClaudeAI/comments/1r7vgam/me_when_claude_wrote_2500_lines_of_perfect_code/,BettaSplendens1,,That's why you need to invest in your claude.md,0,False,13,0,0,0,,False,False,1771406733.0,2026-02-18,9.0,182.4
o60lf2u,https://reddit.com/r/ClaudeAI/comments/1r7vgam/me_when_claude_wrote_2500_lines_of_perfect_code/,,,,0,False,0,0,0,0,,True,False,0.0,,,
l6916x1,https://reddit.com/r/ChatGPT/comments/1d3q2qr/hardly_any_of_us_are_using_ai_tools_like_chatgpt/,AutoModerator,,"Hey /u/JStheKiD!

If your post is a screenshot of a ChatGPT, conversation please reply to this message with the [conversation link](https://help.openai.com/en/articles/7925741-chatgpt-shared-links-faq) or prompt.

If your post is a DALL-E 3 image post, please reply with the prompt used to make this image.

Consider joining our [public discord server](https://discord.gg/r-chatgpt-1050422060352024636)! We have free bots with GPT-4 (with vision), image generators, and more!

 &amp;#x1F916;

Note: For any ChatGPT-related concerns, email support@openai.com


*I am a bot, and this action was performed automatically. Please [contact the moderators of this subreddit](/message/compose/?to=/r/ChatGPT) if you have any questions or concerns.*",0,False,1,0,0,0,moderator,False,False,1717025880.0,2024-05-29,23.0,0.0
l697fk5,https://reddit.com/r/ChatGPT/comments/1d3q2qr/hardly_any_of_us_are_using_ai_tools_like_chatgpt/,[deleted],,"Subs like this would have you believe that like 50% of the world is using ChatGPT every day.

I work at a school. ChatGPT is very helpful for some tasks, like generating ideas for lesson plans or feedback comments that students/parents never read anyway, but I'm the only teacher at my school that uses it (or admits to it, anyway). Nearly all the other teachers just think it is a stupid tool that only kids use to cheat on homework (which happens, but 90% of the homework teachers give out is pretty useless, anyway). 

Most regular people can't think of much use for an LLM or MMLM aside from asking it the same random-ass things they would ask Alexa or Siri or Google Assistant like ""a yo so like how do i make a million dollar asap"".",0,False,1510,0,0,0,,False,False,1717028420.0,2024-05-30,0.0,42.4
l69bxst,https://reddit.com/r/ChatGPT/comments/1d3q2qr/hardly_any_of_us_are_using_ai_tools_like_chatgpt/,[deleted],,"Most people don't go out of their way to seek AI's help. Current state of AI is amazing and disappointing at the same time - it amazes you for what it can do but when actually doing it - it's half-baked.

I think Apple has the right idea - they are going to put AI into their phones that assist in a subtle way that most people are not even aware they are using AI. It will help with daily tasks instead of being a chatbot.",0,False,396,0,0,0,,False,False,1717030271.0,2024-05-30,0.0,73.2
l69rba5,https://reddit.com/r/ChatGPT/comments/1d3q2qr/hardly_any_of_us_are_using_ai_tools_like_chatgpt/,Ilves7,,"I work in healthcare, partially Analytics, and AI will probably take the analytics part of my job at some point, but I can't use it at work for analysis because I can't give it any datasets due to privacy and HIPAA, any applications and data upload has to be approved etc before it can be used.",0,False,198,0,0,0,,False,False,1717036701.0,2024-05-30,2.0,180.4
l69n3sn,https://reddit.com/r/ChatGPT/comments/1d3q2qr/hardly_any_of_us_are_using_ai_tools_like_chatgpt/,FeltSteam,,"In total ChatGPT has about 180 million users. That is worldwide though, and the site gets over a billion visits each month. But it is interesting to see how it compares to other websites out there

https://preview.redd.it/gf3ugdz72h3d1.png?width=1084&amp;format=png&amp;auto=webp&amp;s=e85bfac06d56ae3fc1cc413d79550dcc6becbd4f",0,False,89,0,0,0,,False,False,1717034912.0,2024-05-30,2.0,150.6
l69aycn,https://reddit.com/r/ChatGPT/comments/1d3q2qr/hardly_any_of_us_are_using_ai_tools_like_chatgpt/,PurpleDrax,,I just don't have any use for it in daily life.,0,False,85,0,0,0,,False,False,1717029870.0,2024-05-30,0.0,66.5
l69w74w,https://reddit.com/r/ChatGPT/comments/1d3q2qr/hardly_any_of_us_are_using_ai_tools_like_chatgpt/,,,,0,False,0,0,0,0,,True,False,0.0,,,
mfigfyc,https://reddit.com/r/singularity/comments/1j1cbxp/claude_just_beat_mt_moon/,Jademalo,,"https://www.twitch.tv/claudeplayspokemon

It took him 78 hours, 8 minutes, and 38 seconds but after becoming Kanto's foremost ladder inspector and rock enjoyer our genius amnesiac is finally out!",0,True,486,0,0,0,,False,False,1740870343.0,2025-03-01,23.0,4.0
mfihn1i,https://reddit.com/r/singularity/comments/1j1cbxp/claude_just_beat_mt_moon/,UnnamedPlayerXY,,Beating Mt Moon (or a maze like it) should become a new benchmark.,0,False,374,0,0,0,,False,False,1740870745.0,2025-03-01,23.0,10.7
mfifytb,https://reddit.com/r/singularity/comments/1j1cbxp/claude_just_beat_mt_moon/,gotbedlam,,I was there. 78 hours.,0,False,144,0,0,0,,False,False,1740870183.0,2025-03-01,23.0,1.3
mfijxcq,https://reddit.com/r/singularity/comments/1j1cbxp/claude_just_beat_mt_moon/,PobrezaMan,,"this is going to be anew benchmarking, lets see how long it takes for claude 4.0 to finichs it, and gpt5",0,False,105,0,0,0,,False,False,1740871527.0,2025-03-01,23.0,23.7
mfinuv7,https://reddit.com/r/singularity/comments/1j1cbxp/claude_just_beat_mt_moon/,Calm_Opportunist,,He just managed to heal his pokemon as well.,0,False,53,0,0,0,,False,False,1740872881.0,2025-03-01,23.0,46.2
mfiimlb,https://reddit.com/r/singularity/comments/1j1cbxp/claude_just_beat_mt_moon/,,,,0,False,0,0,0,0,,True,False,0.0,,,
