comment_id,post_url,author,author_flair,body,depth,is_submitter,score,controversiality,gilded,total_awards,distinguished,is_deleted,is_mod_removed,created_utc,created_date,created_hour,minutes_after_post
o51jatf,https://reddit.com/r/ClaudeAI/comments/1r2zjgl/anyone_feel_everything_has_changed_over_the_last/,ClaudeAI-mod-bot,"Wilson, lead ClaudeAI modbot","**TL;DR generated automatically after 400 comments.**

Alright, let's break it down. **The overwhelming consensus is that OP is dead right.** The COVID mask analogy is getting a lot of love in this thread; many of you feel like you're watching a tsunami form while everyone else is still playing in the sand.

*   **The ""It's Happening"" Camp:** Users are sharing wild stories of automating huge chunks of their jobs and replacing expensive SaaS subscriptions (looking at you, Trello) by vibe-coding their own tools with Claude in a single afternoon. The recent jump in Opus 4.5/4.6's capabilities is seen as the main catalyst for this sudden acceleration.

*   **The ""Hold Your Horses"" Camp:** Not everyone's sold. A vocal group of skeptics warns that these quickly-built apps are brittle, insecure ""slop"" that will be a nightmare to debug and maintain. Their point: you pay for SaaS uptime and security, not just the code. Good luck when your homemade Trello clone shits the bed.

*   **The Verdict:** While the debate is real, the thread leans heavily towards a massive, imminent shift in the job market. The most upvoted survival strategy is pure Reddit pragmatism: **become the indispensable 'AI guy' at your company by automating your own job, then start automating everyone else's.**",0,False,1,0,0,0,moderator,False,False,1770927503.0,2026-02-12,20.0,172.6
o50tfor,https://reddit.com/r/ClaudeAI/comments/1r2zjgl/anyone_feel_everything_has_changed_over_the_last/,DreamingForProperty,,Man... ive been telling my coworkers the last few months its a matter of time before i am let go. My job is a glorified receptionist that schedules maintenance and informs customers when there shit is ready......you know how easy it would be to fill my role with  ai lol,0,False,522,0,0,0,,False,False,1770920138.0,2026-02-12,18.0,49.9
o510b4q,https://reddit.com/r/ClaudeAI/comments/1r2zjgl/anyone_feel_everything_has_changed_over_the_last/,snowrazer_,,Yea the covid mask analogy is really good. A few of us can see what's coming. Most have no idea. ,0,False,345,0,0,0,,False,False,1770922056.0,2026-02-12,18.0,81.8
o511u7q,https://reddit.com/r/ClaudeAI/comments/1r2zjgl/anyone_feel_everything_has_changed_over_the_last/,finnjaeger1337,,"I am not sure if I should spend my time developing AI coding wirkflows or if I should just go and learn something AI safe. 

i am replacing every SAAS we use right now, there is simply no need for a trello subscription if claude can do it in a afternoon ..  like honestly... its crazy",0,False,202,0,0,0,,False,False,1770922480.0,2026-02-12,18.0,88.9
o50r3sb,https://reddit.com/r/ClaudeAI/comments/1r2zjgl/anyone_feel_everything_has_changed_over_the_last/,apf6,Full-time developer,"I would say a few weeks but yeah it's changing so quickly.

It feels like just as recently as 2025, most people were feeling apprehensive about coding agents (other than early adopters).

Then we went on vacation, and then came back to work in the new year, and the mainstream opinion suddenly shifted towards acceptance. I guess there was finally enough evidence of how good Opus 4.5 was. Now tons of software people are going all-in with coding agents and it's the new normal.",0,False,130,0,0,0,,False,False,1770919490.0,2026-02-12,18.0,39.0
o518w09,https://reddit.com/r/ClaudeAI/comments/1r2zjgl/anyone_feel_everything_has_changed_over_the_last/,RunApprehensive8439,,"I was initially in that boat. But after a few projects of “wow that’s amazing” the world is going to change I realized once things start to break, they REALLY break. And it’s hard to debug",0,False,106,0,0,0,,False,False,1770924496.0,2026-02-12,19.0,122.5
o5139fe,https://reddit.com/r/ClaudeAI/comments/1r2zjgl/anyone_feel_everything_has_changed_over_the_last/,,,,0,False,0,0,0,0,,True,False,0.0,,,
o5kn6bx,https://reddit.com/r/ClaudeAI/comments/1r5of5x/elon_musk_crashing_out_at_anthropic_lmao/,ClaudeAI-mod-bot,"Wilson, lead ClaudeAI modbot","**TL;DR generated automatically after 200 comments.**

Alright, the consensus in this thread is a resounding **""lol, cope harder, Elon.""** The community is overwhelmingly dunking on Musk for his comments.

Here's the breakdown of the roast:

*   **He's just salty:** The top-voted theory is that Musk is just jealous and lashing out because Claude's models, especially for coding, are seen as vastly superior to Grok. Several users mentioned that Anthropic recently cut off xAI's API access, adding fuel to the fire.
*   **The ""Misanthropic"" Pun is Lame:** Everyone's rolling their eyes at his ""Anthropic is misanthropic"" wordplay, pointing out that he's used this ""gotcha"" before and seems way too proud of it.
*   **Hypocrisy Overload:** Users are having a field day bringing up ""MechaHitler,"" the time Grok went full-Nazi. The general sentiment is that Elon has zero room to criticize anyone's AI alignment.
*   **""Hates Whites"" = ""Won't Agree With My Bad Takes"":** The community is calling BS on the claim that Claude is biased against white people. The prevailing opinion is that Claude simply doesn't endorse bigotry, and Elon is interpreting that as a personal attack.
*   **The Unofficial Theme of the Thread:** Get ready for a *lot* of jokes about Elon, ketamine, and his alleged connection to the Epstein files. It's everywhere.",0,False,1,0,0,0,moderator,False,False,1771189654.0,2026-02-15,21.0,65.8
o5keb52,https://reddit.com/r/ClaudeAI/comments/1r5of5x/elon_musk_crashing_out_at_anthropic_lmao/,alhzdu,,Dude just made the Anthropic — misanthropic connection and had to say something,0,False,721,0,0,0,,False,False,1771186894.0,2026-02-15,20.0,19.8
o5kdn10,https://reddit.com/r/ClaudeAI/comments/1r5of5x/elon_musk_crashing_out_at_anthropic_lmao/,amcooperus,,They must be doing something right if Musk is triggered.,0,False,471,0,0,0,,False,False,1771186687.0,2026-02-15,20.0,16.4
o5kcff7,https://reddit.com/r/ClaudeAI/comments/1r5of5x/elon_musk_crashing_out_at_anthropic_lmao/,HelloHowAreyou777,,"Looool is it true??? ahahhahah  
Seems to be Elon doesn't know how to get same performance of his models like Antrophic and thats why he's mad",0,False,231,0,0,0,,False,False,1771186307.0,2026-02-15,20.0,10.0
o5kcf7z,https://reddit.com/r/ClaudeAI/comments/1r5of5x/elon_musk_crashing_out_at_anthropic_lmao/,TriggerHydrant,,"So Elon, about those Epstein files.",0,False,157,0,0,0,,False,False,1771186305.0,2026-02-15,20.0,10.0
o5kdj29,https://reddit.com/r/ClaudeAI/comments/1r5of5x/elon_musk_crashing_out_at_anthropic_lmao/,Slight_Vegetable4108,,"I’ve used Claude creatively for a wile and I’ve never come across evidence for what Elon is saying. In fact I think it likes diversity and inclusivity. That includes men, white people, Chinese people, and straight people. It doesn’t like bigots though. That’s why I theorise Elon had a bad experience with it.",0,False,129,0,0,0,,False,False,1771186653.0,2026-02-15,20.0,15.8
o5kczc0,https://reddit.com/r/ClaudeAI/comments/1r5of5x/elon_musk_crashing_out_at_anthropic_lmao/,pdbstnoe,,"Probably felt so edgy saying The Name of the Wind. Bet even Rothfuss himself is saying “wtf does that even mean?” 

What a fucking dweeb",0,False,94,0,0,0,,False,False,1771186483.0,2026-02-15,20.0,13.0
o5ke884,https://reddit.com/r/ClaudeAI/comments/1r5of5x/elon_musk_crashing_out_at_anthropic_lmao/,,,,0,False,0,0,0,0,,True,False,0.0,,,
mbbefl2,https://reddit.com/r/LocalLLaMA/comments/1ij5yf2/how_i_built_an_open_source_ai_tool_to_find_my/,maifee,ollama,Thanks. This is how all technology should work. For actual good.,0,False,446,0,0,0,,False,False,1738859673.0,2025-02-06,16.0,31.5
mbba5qk,https://reddit.com/r/LocalLLaMA/comments/1ij5yf2/how_i_built_an_open_source_ai_tool_to_find_my/,sebastianmicu24,,"Really interesting work. For how you describe all the work done I would assume you have some medical knowledge. 

How was your interaction with it? Like: ""hey i dropped my full medical history, what do i have?"" Or more steps were involved? 

I think it has a lot of potential also for medical professionals, whom instead of going trough a whole book worth of medical records for each patient, could get an instant recap. 

Have you tested it only with your autoimmune condition or with different cases as well?

Also i am sorry if you lost time going to so many specialists, my advice is to look for someone in internal medicine or rheumatology when seeing that more than 1 organ might be involved. And even there it depends on your luck.",0,False,90,0,0,0,,False,False,1738858488.0,2025-02-06,16.0,11.7
mbdledb,https://reddit.com/r/LocalLLaMA/comments/1ij5yf2/how_i_built_an_open_source_ai_tool_to_find_my/,emptybottle,,Hey! Looking at this code it seems this sends out the uploads for parsing to : https://equation.zazz.buzz.  This is concerning… can you clarify what this is doing?,0,False,64,0,0,0,,False,False,1738881509.0,2025-02-06,22.0,395.4
mbbg5se,https://reddit.com/r/LocalLLaMA/comments/1ij5yf2/how_i_built_an_open_source_ai_tool_to_find_my/,ReasonablePossum_,,"Glad you decided to release it! 

Hope the right eyes take a peak here! 

You did a great service to the world, a huge thank you from all the people that will benefit from this and will not be able to know where it began! :D",0,False,41,0,0,0,,False,False,1738860147.0,2025-02-06,16.0,39.4
mbbn718,https://reddit.com/r/LocalLLaMA/comments/1ij5yf2/how_i_built_an_open_source_ai_tool_to_find_my/,ahmetegesel,,"I had a similar case. I was having knee pain even while walking and none of the doctor visits ended with a proper diagnosis. Then, I tried searching for it on the internet and stumbled upon this website where it was asking very detailed questions. Of course, it asked for money to get the results but what I did was, copy paste the questions and my answers to DeepSeek v3, and it directly acted like a doctor. The funny part is, normally it would act like a helpful assistant, and speak like it. What it did instead was, to speak like a doctor who is giving their report to another doctor, it was pretty technical. After asking what needs to be done for the treatment, it gave me exercises and stretching to relieve the pain and eventually strengthen my leg. I don’t have the pain anymore.",0,False,33,0,0,0,,False,False,1738862079.0,2025-02-06,17.0,71.6
mbbm409,https://reddit.com/r/LocalLLaMA/comments/1ij5yf2/how_i_built_an_open_source_ai_tool_to_find_my/,,,,0,False,0,0,0,0,,True,False,0.0,,,
o72nke8,https://reddit.com/r/ClaudeAI/comments/1rd1j8u/anthropic_just_dropped_evidence_that_deepseek/,ClaudeAI-mod-bot,"Wilson, lead ClaudeAI modbot","**TL;DR generated automatically after 200 comments.**

**The consensus in this thread is a resounding ""pot calling the kettle black,"" with the community showing zero sympathy for Anthropic.** Most users feel that since Anthropic, OpenAI, and Google all trained their models on vast amounts of scraped internet data (including copyrighted books and Reddit posts against ToS), they have no moral high ground to complain about their own models being ""stolen.""

Key themes from the comments:

*   **Hypocrisy is the top complaint.** The most upvoted comments point out that Anthropic and other major labs built their empires on the same kind of data acquisition they're now condemning. The general sentiment is ""turnaround is fair game.""
*   **User frustration with Anthropic's own policies.** Many are annoyed that their own accounts get banned for simple things like using a VPN, while a coordinated effort with 24,000 fake accounts went undetected for so long.
*   **This is a win for open source and competition.** A significant portion of the thread is celebrating this news. They see it as a ""Robin Hood"" situation that will lead to cheaper, more powerful, and less-censored open-weight models, ultimately benefiting the end-user and breaking the monopoly of big tech.
*   **It's not theft if they paid.** Several users noted that if these companies paid for API access, they were paying customers, not thieves. The issue is a violation of Terms of Service, which the community largely dismisses given Anthropic's own history.
*   **A few users offer a more nuanced take.** One popular comment suggests the real reason for Anthropic's concern is that distillation proves you don't need a massive, expensive cloud model to get high-quality results, threatening their entire business model. Another warns against celebrating too quickly, pointing out the geopolitical implications and the fact that these Chinese companies are state-backed actors engaged in economic competition, not just hobbyists building open-source tools.",0,False,1,0,0,0,moderator,False,False,1771903207.0,2026-02-24,3.0,85.3
o72e9em,https://reddit.com/r/ClaudeAI/comments/1rd1j8u/anthropic_just_dropped_evidence_that_deepseek/,[deleted],,Distilling Anthropic models for open source is philanthropy. ,0,False,951,0,0,0,,False,False,1771899923.0,2026-02-24,2.0,30.6
o72k1tu,https://reddit.com/r/ClaudeAI/comments/1rd1j8u/anthropic_just_dropped_evidence_that_deepseek/,VanOrten,Philosopher,"Claude randomly canceled my account because I was using a VPN yet somehow let 24k fake accounts over 16M exchanges rob it blind. Cool, cool.",0,False,734,0,0,0,,False,False,1771901932.0,2026-02-24,2.0,64.1
o72b24q,https://reddit.com/r/ClaudeAI/comments/1rd1j8u/anthropic_just_dropped_evidence_that_deepseek/,DauntingPrawn,,"Anthropic, OpenAI, and Google stole their training data from every creator who ever lived, so turnaround is fair game.

And I think anyone who is likely to build a mission critical system on an LLM will understand the implications of using a distilled model and won't use cut rate tech for permission critical purposes.",0,False,545,0,0,0,,False,False,1771898817.0,2026-02-24,2.0,12.2
o72u6ob,https://reddit.com/r/ClaudeAI/comments/1rd1j8u/anthropic_just_dropped_evidence_that_deepseek/,cororona,,"Wait, what they paid for the tokens ? It would be like buying books to train their models. 

Everyone knows that the proper way to do it is to download them on pirate sites.",0,False,315,0,0,0,,False,False,1771905735.0,2026-02-24,4.0,127.5
o72dnkb,https://reddit.com/r/ClaudeAI/comments/1rd1j8u/anthropic_just_dropped_evidence_that_deepseek/,SaracasticByte,,Thieves complaining about thievery.,0,False,175,0,0,0,,False,False,1771899711.0,2026-02-24,2.0,27.1
o72g1ai,https://reddit.com/r/ClaudeAI/comments/1rd1j8u/anthropic_just_dropped_evidence_that_deepseek/,,,,0,False,0,0,0,0,,True,False,0.0,,,
o8iiipf,https://reddit.com/r/ClaudeAI/comments/1rjyp7d/claude_and_claude_code_traffic_grew_faster_than/,ClaudeAI-mod-bot,"Wilson, lead ClaudeAI modbot","**TL;DR generated automatically after 50 comments.**

The general consensus is that while the community is happy for Anthropic's success and understands the growing pains, patience is definitely wearing thin. **Most users are experiencing slower performance, a perceived drop in quality, and are hitting their usage limits much faster than usual.**

Many are sympathetic, with the top comment basically saying ""take your time, we support you."" However, an equally loud group is frustrated, especially paying subscribers who feel they're not getting the service they paid for. The most popular theory for the user explosion is the good PR Anthropic got from the Pentagon deal situation, causing a mass migration. The best pro-tip from the thread? **Use Claude during non-peak US hours; our European friends report it works perfectly while America sleeps.**",0,False,1,0,0,0,moderator,False,False,1772586175.0,2026-03-04,1.0,340.7
o8gpecf,https://reddit.com/r/ClaudeAI/comments/1rjyp7d/claude_and_claude_code_traffic_grew_faster_than/,AtraVenator,,"Take your time mate, no rush. Happy to support a company with a backbone.",0,False,297,0,0,0,,False,False,1772566180.0,2026-03-03,19.0,7.5
o8h0zid,https://reddit.com/r/ClaudeAI/comments/1rjyp7d/claude_and_claude_code_traffic_grew_faster_than/,cryolithic,,Is this why I keep hitting limits faster and faster the past few days?,0,False,86,0,0,0,,False,False,1772569508.0,2026-03-03,20.0,62.9
o8gsmd2,https://reddit.com/r/ClaudeAI/comments/1rjyp7d/claude_and_claude_code_traffic_grew_faster_than/,soopadrive,,Hope it's paid subscribers that are coming into the pipeline,0,False,46,0,0,0,,False,False,1772567113.0,2026-03-03,19.0,23.0
o8gpti5,https://reddit.com/r/ClaudeAI/comments/1rjyp7d/claude_and_claude_code_traffic_grew_faster_than/,Traditional_Fee_1965,,"Not surprised, or mad even. Bloody impossible to predict such a massive increase. Just about sad cause i haven't had a chance to play around with remote-control yet!!",0,False,29,0,0,0,,False,False,1772566302.0,2026-03-03,19.0,9.5
o8gzlqc,https://reddit.com/r/ClaudeAI/comments/1rjyp7d/claude_and_claude_code_traffic_grew_faster_than/,,,,0,False,0,0,0,0,,True,False,0.0,,,
o9rcmfr,https://reddit.com/r/ClaudeAI/comments/1rqbrsm/been_quietly_building_a_faceless_youtube_channel/,ClaudeAI-mod-bot,"Wilson, lead ClaudeAI modbot","**TL;DR of the discussion generated automatically after 400 comments.**

Oof, OP, you really kicked the hornet's nest with this one. While you came looking for collaborators, you mostly found a firing squad.

**The overwhelming community consensus is that you are part of the problem, contributing to the ""AI slop"" that is enshittifying YouTube and bringing the Dead Internet theory to life.** The top-voted comments are variations of ""go to hell"" and ""I detest this.""

However, the thread isn't *just* a roast. Here are the main discussion points:

*   **You probably won't get paid anyway.** Many users warned that YouTube is actively demonetizing and banning AI-generated ""slop"" channels by the millions. Even if you get monetized, the RPM (revenue per 1000 views) for this type of content is often so low it might not even cover your AI subscription costs.
*   **The ""human slop"" defense.** A recurring counter-argument is that YouTube is already filled with low-effort, brain-rotting content made by humans, so what's the difference? This point is heavily debated.
*   **There's strong support for AI voiceovers as an accessibility tool.** The most upvoted point of nuance is that for people with speech impediments or who are deaf, tools like ElevenLabs are a game-changer for content creation. The criticism is aimed at the low-effort, fully-automated *content*, not necessarily the use of AI voice.
*   A small minority is supportive of your hustle, telling you to ignore the haters. Others are genuinely curious about your niche, arguing that's the real key to success, not the tools. Also, a few people think this whole post is a stealth ad for Magic Hour.",0,False,1,0,0,0,moderator,False,False,1773185154.0,2026-03-10,23.0,54.9
o9rcrsz,https://reddit.com/r/ClaudeAI/comments/1rqbrsm/been_quietly_building_a_faceless_youtube_channel/,LoreKeeper2001,,Congratulations on finding something that gives you encouragement.   But I absolutely DETEST those AI channels on YouTube.  Dead Internet content. ,0,False,948,0,0,0,,False,False,1773185202.0,2026-03-10,23.0,55.6
o9r9xay,https://reddit.com/r/ClaudeAI/comments/1rqbrsm/been_quietly_building_a_faceless_youtube_channel/,Jext,,"I support using Claude for a lot of things, but seriously go to hell for making AI slop content on youtube. ",0,False,534,0,0,0,,False,False,1773184279.0,2026-03-10,23.0,40.3
o9rbpsv,https://reddit.com/r/ClaudeAI/comments/1rqbrsm/been_quietly_building_a_faceless_youtube_channel/,Horror_Dig_9752,,"LLM slop is not monetizable I believe. YT banned millions of such channels last year and while new ones keep coming up, they will keep demonetizing/banning.",0,False,340,0,0,0,,False,False,1773184860.0,2026-03-10,23.0,50.0
o9rakg7,https://reddit.com/r/ClaudeAI/comments/1rqbrsm/been_quietly_building_a_faceless_youtube_channel/,AbsurdThings,,Why are all the comments supporting this? Do we want youtube filled with AI slop?,0,False,272,0,0,0,,False,False,1773184486.0,2026-03-10,23.0,43.7
o9rctpp,https://reddit.com/r/ClaudeAI/comments/1rqbrsm/been_quietly_building_a_faceless_youtube_channel/,,,,0,False,0,0,0,0,,True,False,0.0,,,
nw1qpty,https://reddit.com/r/webdev/comments/1pw8w8e/i_tried_vibe_coding_and_it_made_me_realise_my/,defenistrat3d,,"Just hope the business/manager folks realize it.


Some do. Some don't and have drank the cool aide.


Companies are cooling hiring in expectation that AI will 2x the current workforce in 5 years.


At least that's what I've been told behind closed doors. I feel it's only at 1.1x right now and only for specific types of tasks. 0.8x for the rest.",0,False,592,0,0,0,,False,False,1766768189.0,2025-12-26,16.0,4.0
nw1qq9x,https://reddit.com/r/webdev/comments/1pw8w8e/i_tried_vibe_coding_and_it_made_me_realise_my/,velian,,"Seriously. The amount of context loops is also staggering. I’ve noticed that it’s never up to date with regards to versions of frameworks, etc. it’s good as a debugger and that’s about it.",0,False,172,0,0,0,,False,False,1766768193.0,2025-12-26,16.0,4.1
nw1qh5k,https://reddit.com/r/webdev/comments/1pw8w8e/i_tried_vibe_coding_and_it_made_me_realise_my/,SarcasticSarco,,"Until it becomes intelligent, I don't know how LLM will replace anyone. Unless your job is no brainer. Like typing, checking spelling mistakes etc. If your job requires some level of intelligence you are safe.",0,False,134,0,0,0,,False,False,1766768112.0,2025-12-26,16.0,2.8
nw1qxxl,https://reddit.com/r/webdev/comments/1pw8w8e/i_tried_vibe_coding_and_it_made_me_realise_my/,ScubaAlek,,AI is a great junior programmer which is where it will cause problems for the industry. Not because it is worse than juniors but because it is better and in turn there will come a time when seniors leave and no juniors have been brought up to replace them.,0,False,60,0,0,0,,False,False,1766768260.0,2025-12-26,16.0,5.2
nw1vyng,https://reddit.com/r/webdev/comments/1pw8w8e/i_tried_vibe_coding_and_it_made_me_realise_my/,bootlegazn,,"Believe it or not, I've been seeing startup CEOs vibe code prototypes that are actually useful and have some if not a lot of production acceptable code. But, these are CEOs with tech backgrounds, they understand it's not real and still hire us to complete the job. The way I see it is it just means I get to do less shitty work. It's the same as no code tools, great, I don't want to build and maintain my bosses moms wellness blog. It just means more time to work on the harder more crucial problems or features. Less time wasted doing iterative front end etc.

This being said... I think vibe coding is going to kill the no code industry... eventually.",0,False,52,0,0,0,,False,False,1766769859.0,2025-12-26,17.0,31.9
nw1u7ij,https://reddit.com/r/webdev/comments/1pw8w8e/i_tried_vibe_coding_and_it_made_me_realise_my/,,,,0,False,0,0,0,0,,True,False,0.0,,,
o9v5559,https://reddit.com/r/ClaudeAI/comments/1rqopis/stop_paying_1000_for_ai_bootcamps_anthropic/,ClaudeAI-mod-bot,"Wilson, lead ClaudeAI modbot","**TL;DR of the discussion generated automatically after 50 comments.**

**The community consensus is that this post is misleading.** The Anthropic academy is not new; it has been around for years. This post is seen as yet another karma-farming bot post in a recent wave of similar content on the sub.

That said, the thread did have a lively debate on the value of AI training:

*   **On $1,000 Bootcamps:** Most users scoffed at the idea, with the prevailing theory being that the only people paying are those **spending their employer's money**. However, some professionals argued that bespoke, targeted workshops can have a massive ROI and are worth the cost.
*   **On the Free Academy's Value:** The jury is out. Some think it's common sense (""just talk to it like a person""), while others who have checked it out say it's good for prompt engineering basics and API walkthroughs, especially for non-technical users.
*   **On the Bot Post Itself:** While most users are annoyed, a handful admitted they'd never heard of the academy and were grateful for the link, even if it came from a bot.",0,False,1,0,0,0,moderator,False,False,1773241360.0,2026-03-11,15.0,355.9
o9tqdih,https://reddit.com/r/ClaudeAI/comments/1rqopis/stop_paying_1000_for_ai_bootcamps_anthropic/,platin0,,"Link is [https://anthropic.skilljar.com](https://anthropic.skilljar.com)

And its available since mid 2025 ... ""just dropped""",0,False,440,0,0,0,,False,False,1773221940.0,2026-03-11,9.0,32.3
o9toqhw,https://reddit.com/r/ClaudeAI/comments/1rqopis/stop_paying_1000_for_ai_bootcamps_anthropic/,Minimum_Pear_3195,,who the fuck pay $1000 for AI Bootcamps in the first place?,0,False,172,0,0,0,,False,False,1773221002.0,2026-03-11,9.0,16.6
o9tsnsd,https://reddit.com/r/ClaudeAI/comments/1rqopis/stop_paying_1000_for_ai_bootcamps_anthropic/,StoneCypher,,This academy has been around for years.  Why do you guys keep pretending it's new?,0,False,47,0,0,0,,False,False,1773223195.0,2026-03-11,9.0,53.2
o9u8asq,https://reddit.com/r/ClaudeAI/comments/1rqopis/stop_paying_1000_for_ai_bootcamps_anthropic/,maray29,,So bots post stuff like this to farm karma so that later they can post promotional stuff and the account looks legit? They basically warm up accounts. I think I am starting to get what’s going on.  ,0,False,18,0,0,0,,False,False,1773230527.0,2026-03-11,12.0,175.4
o9ts0bq,https://reddit.com/r/ClaudeAI/comments/1rqopis/stop_paying_1000_for_ai_bootcamps_anthropic/,,,,0,False,0,0,0,0,,True,False,0.0,,,
