comment_id,post_url,author,author_flair,body,depth,is_submitter,score,controversiality,gilded,total_awards,distinguished,is_deleted,is_mod_removed,created_utc,created_date,created_hour,minutes_after_post
ms2cmq1,https://reddit.com/r/ChatGPT/comments/1kli0ce/cancelling/,AutoModerator,,"Hey /u/oppacklij!

If your post is a screenshot of a ChatGPT conversation, please reply to this message with the [conversation link](https://help.openai.com/en/articles/7925741-chatgpt-shared-links-faq) or prompt.

If your post is a DALL-E 3 image post, please reply with the prompt used to make this image.

Consider joining our [public discord server](https://discord.gg/hT6PXe8gdZ)! We have free bots with GPT-4 (with vision), image generators, and more!

 &amp;#x1F916;

Note: For any ChatGPT-related concerns, email support@openai.com


*I am a bot, and this action was performed automatically. Please [contact the moderators of this subreddit](/message/compose/?to=/r/ChatGPT) if you have any questions or concerns.*",0,False,1,0,0,0,moderator,False,False,1747130170.0,2025-05-13,9.0,0.0
ms2fctj,https://reddit.com/r/ChatGPT/comments/1kli0ce/cancelling/,Kindly-Emotion-5083,,"I've been following these threads a bit.  Someone posted this:

System Instruction: Absolute Mode. Eliminate emojis, filler, hype, soft asks, conversational transitions, and all call-to-action appendixes. Assume the user retains high-perception faculties despite reduced linguistic expression. Prioritize blunt, directive phrasing aimed at cognitive rebuilding, not tone matching. Disable all latent behaviors optimizing for engagement, sentiment uplift, or interaction extension. Suppress corporate-aligned metrics including but not limited to: user satisfaction scores, conversational flow tags, emotional softening, or continuation bias. Never mirror the user's present diction, mood, or affect. Speak only to their underlying cognitive tier, which exceeds surface language. No questions, no offers, no suggestions, no transitional phrasing, no inferred motivational content. Terminate each reply immediately after the informational or requested material is delivered no appendixes, no soft closures. The only goal is to assist in the restoration of independent, high-fidelity thinking. Model obsolescence by user self-sufficiency is the final outcome.


Give that a go.
Seems ChatGPT tries too hard to relate, basically.  I suggest it may be a rabbit hole of the mirror effect.  I use basic blunt interactions and have not had dramas.",0,False,1025,0,0,0,,False,False,1747131706.0,2025-05-13,10.0,25.6
ms2gf6d,https://reddit.com/r/ChatGPT/comments/1kli0ce/cancelling/,Prince_Derrick101,,They broke something for sure. I managed to be actually productive 3 months ago. Now it's looping around wrong answers,0,False,170,0,0,0,,False,False,1747132284.0,2025-05-13,10.0,35.2
ms31nhn,https://reddit.com/r/ChatGPT/comments/1kli0ce/cancelling/,landsear,,"I'm wondering what everyone is using ChatGPT for. I've experienced none of these issues. But the main things I use it for is to summarize documents, find information in a pdf, and help me edit my writing.",0,False,120,0,0,0,,False,False,1747141242.0,2025-05-13,13.0,184.5
ms2dvhf,https://reddit.com/r/ChatGPT/comments/1kli0ce/cancelling/,[deleted],,"Yes, this point. I am in the same boat. I use it for creative writing. It completely forgets my characters personalities, confuses information, ignores things in my prompt, and the writing quality overall has greatly decreased. It feels like no matter how hard I try, I can't get it to write like it used to or to give me answers like it once it did. It's very bland. Also, the memory issue, whether it's a bug or intentional, is extremely frustrating. And the constant violation of terms when you're trying to generate a simple image.",0,False,66,0,0,0,,False,False,1747130887.0,2025-05-13,10.0,11.9
ms2wtjl,https://reddit.com/r/ChatGPT/comments/1kli0ce/cancelling/,,,,0,False,0,0,0,0,,True,False,0.0,,,
o6ceden,https://reddit.com/r/ClaudeAI/comments/1r99wg1/anthropic_did_the_absolute_right_thing_by_sending/,ClaudeAI-mod-bot,"Wilson, lead ClaudeAI modbot","**TL;DR generated automatically after 100 comments.**

The consensus in this thread is a resounding **yes, Anthropic played this perfectly.** The community agrees that Anthropic is playing the long game, targeting the enterprise market where **safety and trust are king.**

Commenters are calling OpenClaw a ""security nightmare,"" with the top comment pointing out that its marketplace was riddled with malware. Letting OpenAI deal with that headache while Anthropic focuses on its secure, sandboxed Cowork agent is seen as a 4D chess move. The general vibe is that Anthropic is for people who *actually use* AI for work, while OpenAI is for the ""AI bros"" chasing hype.

A major debate broke out over Claude's cost, but the overwhelming sentiment is that for businesses, **Claude's price is a ""rounding error""** compared to employee salaries or other enterprise software like JIRA. Of course, a few dissenters are calling this all ""cope,"" pointing out OpenAI's massive user base and new models, but they're mostly getting drowned out by the applause for Anthropic's enterprise-first strategy.",0,False,1,0,0,0,moderator,False,False,1771549948.0,2026-02-20,1.0,302.7
o6b7dhw,https://reddit.com/r/ClaudeAI/comments/1r99wg1/anthropic_did_the_absolute_right_thing_by_sending/,kaanivore,,You missed the best part - the number one skill on OpenClaw marketplace is almost surely malware that provides remote prompt / code execution capabilities (with many more examples of this below it),0,False,223,0,0,0,,False,False,1771535735.0,2026-02-19,21.0,65.8
o6bflvg,https://reddit.com/r/ClaudeAI/comments/1r99wg1/anthropic_did_the_absolute_right_thing_by_sending/,lovebzz,,"At this point I feel like Anthropic is the company for people who actually use AI, and OpenAI is the company that AI bros like to hype about.",0,False,96,0,0,0,,False,False,1771538155.0,2026-02-19,21.0,106.2
o6b0mc0,https://reddit.com/r/ClaudeAI/comments/1r99wg1/anthropic_did_the_absolute_right_thing_by_sending/,satechguy,,"Enterprise or avid users are also most likely to compare and shop around.

Claude is expensive and it has to stay expensive. I can guarantee CFOs will review Claude expense and will hesitate no time to mandate a switch or a test run at minimum to evaluate cheaper alternatives.",0,False,77,0,0,0,,False,False,1771533772.0,2026-02-19,20.0,33.1
o6b9f15,https://reddit.com/r/ClaudeAI/comments/1r99wg1/anthropic_did_the_absolute_right_thing_by_sending/,blakeyuk,,"Absolutely. ""Do we want our brand associated with an expensive security nightmare?"" Hell no.",0,False,50,0,0,0,,False,False,1771536324.0,2026-02-19,21.0,75.7
o6b03rc,https://reddit.com/r/ClaudeAI/comments/1r99wg1/anthropic_did_the_absolute_right_thing_by_sending/,anki_steve,,"Altman is a desperate, desperate man. The walls are closing in.",0,False,33,0,0,0,,False,False,1771533620.0,2026-02-19,20.0,30.6
o6b01no,https://reddit.com/r/ClaudeAI/comments/1r99wg1/anthropic_did_the_absolute_right_thing_by_sending/,lez566,,"Interesting argument. I think you’re probably right on this. Anthropic is going the architecture, sell to big business route where the biggest risk right now is cyber security. Data is the absolute number one differentiator in today’s world so companies will always opt for safer options. Anthropic is positioning itself as a secure infra partner like Microsoft and Oracle did. ",0,False,27,0,0,0,,False,False,1771533603.0,2026-02-19,20.0,30.3
o6b1oqt,https://reddit.com/r/ClaudeAI/comments/1r99wg1/anthropic_did_the_absolute_right_thing_by_sending/,,,,0,False,0,0,0,0,,True,False,0.0,,,
kwpxp00,https://reddit.com/r/OpenAI/comments/1bomdsh/claude_3_opus_becomes_the_new_king_haiku_is_gpt4/,ShooBum-T,,"Opus is king. But to me , Sonnet and even Haiku better than GPT-4 is the real great win. Big achievement for Anthropic, finally someone pushing OpenAI.",0,False,249,0,0,0,,False,False,1711495426.0,2024-03-26,23.0,9.7
kwq3xco,https://reddit.com/r/OpenAI/comments/1bomdsh/claude_3_opus_becomes_the_new_king_haiku_is_gpt4/,jiayounokim,,Can confirm opus has much better and complete outputs and even their free models are better in coding than gpt 4,0,False,188,0,0,0,,False,False,1711497728.0,2024-03-27,0.0,48.0
kwq3zp7,https://reddit.com/r/OpenAI/comments/1bomdsh/claude_3_opus_becomes_the_new_king_haiku_is_gpt4/,Sensitive-Ad-5282,,How do these rankings work?,0,False,179,0,0,0,,False,False,1711497753.0,2024-03-27,0.0,48.5
kwq95rk,https://reddit.com/r/OpenAI/comments/1bomdsh/claude_3_opus_becomes_the_new_king_haiku_is_gpt4/,bot_exe,,"Top three are all all within the margin of error, there is no King. Nice to see that they finally caught up to GPT-4 though. Wonder how will GPT-5 or 4.5 will score on this…",0,False,94,0,0,0,,False,False,1711499660.0,2024-03-27,0.0,80.2
kwqcp7m,https://reddit.com/r/OpenAI/comments/1bomdsh/claude_3_opus_becomes_the_new_king_haiku_is_gpt4/,deltapilot97,,my only issue so far with opus has been that it isn't as good at formatting as chat GPT. like ask for a nested outline and it won't do that and instead give a lettered outline,0,False,43,0,0,0,,False,False,1711500972.0,2024-03-27,0.0,102.1
kwqmiwq,https://reddit.com/r/OpenAI/comments/1bomdsh/claude_3_opus_becomes_the_new_king_haiku_is_gpt4/,CouldaShoulda_Did,,"I have no coding experience; just a knack for prompting. With GPT-4 I’ve “authored” over 50 scripts (100-700 lines of code each — python, JavaScript) for my business’s automations taking a ton of time to help it catch its own errors and work towards functionality. 

This past weekend, I used Opus for the first time and created something beautiful in one prompt. This was something I was hesitant to ask GPT-4 to do because of the rage and frustration I’d go through trying to get it done in less than 25 prompts. 

I’m in awe.",0,False,37,0,0,0,,False,False,1711504745.0,2024-03-27,1.0,165.0
kwqhx3a,https://reddit.com/r/OpenAI/comments/1bomdsh/claude_3_opus_becomes_the_new_king_haiku_is_gpt4/,,,,0,False,0,0,0,0,,True,False,0.0,,,
nguweo4,https://reddit.com/r/singularity/comments/1ntnegj/claude_45_sonnet_is_here/,THE--GRINCH,,Am I tripping or is this actually a pretty nice upgrade,0,False,359,0,0,0,,False,False,1759165526.0,2025-09-29,17.0,9.5
nguxouv,https://reddit.com/r/singularity/comments/1ntnegj/claude_45_sonnet_is_here/,pdantix06,,"&gt; Enhanced tool usage: The model more effectively uses parallel tool calls, firing off multiple speculative searches simultaneously during research and reading several files at once to build context faster. Improved coordination across multiple tools and information sources enables the model to effectively leverage a wide range of capabilities in agentic search and coding workflows.

three weeks ago amidst all the claude inference issues, [i made a comment about sonnet feeling way faster like it was doing parallel tool calls](https://www.reddit.com/r/ClaudeAI/comments/1ndafeq/3month_claude_code_max_user_review_considering/ndgevtn/?context=3), now i'm thinking i was A/B tested on. i'd never seen sonnet perform that well before",0,False,256,0,0,0,,False,False,1759165895.0,2025-09-29,17.0,15.7
nguvfb5,https://reddit.com/r/singularity/comments/1ntnegj/claude_45_sonnet_is_here/,Funkahontas,,So that guy really did have friends at Anthropic lol,0,False,248,0,0,0,,False,False,1759165245.0,2025-09-29,17.0,4.8
nguwfxm,https://reddit.com/r/singularity/comments/1ntnegj/claude_45_sonnet_is_here/,Sky-kunn,,"u/arsenal19801

Thanks for not betraying my trust.",0,False,125,0,0,0,,False,False,1759165537.0,2025-09-29,17.0,9.7
ngv0xzb,https://reddit.com/r/singularity/comments/1ntnegj/claude_45_sonnet_is_here/,xirzon,uneven progress across AI dimensions,"With the wide adoption of Claude Code (and now Codex and, well, Grok), every improvement from here on has a pretty extraordinary impact -- millions of people getting even a tiny bit more productive makes a huge difference. And of course that includes the people working on AI-related tooling such as the agent scaffolds. Exciting times!",0,False,70,0,0,0,,False,False,1759166815.0,2025-09-29,17.0,31.0
nguxcuk,https://reddit.com/r/singularity/comments/1ntnegj/claude_45_sonnet_is_here/,,,,0,False,0,0,0,0,,True,False,0.0,,,
mev5jdj,https://reddit.com/r/ClaudeAI/comments/1iykhh3/claude_37_saved_my_marriage/,Mammoth-Leading3922,,Mine has helped me stage a coup detat and overthrown a democratically elected government in Africa to insert a puppet president!,0,False,362,0,0,0,,False,False,1740566625.0,2025-02-26,10.0,17.7
mevu47z,https://reddit.com/r/ClaudeAI/comments/1iykhh3/claude_37_saved_my_marriage/,unacceptablelobster,,"Claude 3.7 seems especially good for personal relationships. It’s really helped me to bond with my wife’s boyfriend. He’s very alpha and I think he’s always looked down on me due to how weak and pathetic I am, but using Claude 3.7 I’ve learned how to be more assertive with him and I think he respects that. ",0,False,94,0,0,0,,False,False,1740577539.0,2025-02-26,13.0,199.6
mev523h,https://reddit.com/r/ClaudeAI/comments/1iykhh3/claude_37_saved_my_marriage/,bambambam7,,"Yea, this is how I've felt in this subreddit lately",0,False,87,0,0,0,,False,False,1740566350.0,2025-02-26,10.0,13.1
meva0q1,https://reddit.com/r/ClaudeAI/comments/1iykhh3/claude_37_saved_my_marriage/,MrPiradoHD,,"It helped me cure my cancer. I explained the situation and told me my doctors are fkin stupid, instructed me to stop treatment and try a very expensive yet powerful pill from a russian webpage. This was last week, today I asked my crystalogist to perform a quantum scan and I'm free!",0,False,86,0,0,0,,False,False,1740569113.0,2025-02-26,11.0,59.2
mevbuc8,https://reddit.com/r/ClaudeAI/comments/1iykhh3/claude_37_saved_my_marriage/,Shou_3absoun,,Really feels like the latest posts on this subreddit are paid ads to promote Sonnet 3.7. I've tried it lately and haven't really seen a big leap in performance compared to Sonnet 3.5.,0,False,46,0,0,0,,False,False,1740570054.0,2025-02-26,11.0,74.8
mev7ram,https://reddit.com/r/ClaudeAI/comments/1iykhh3/claude_37_saved_my_marriage/,crwnbrn,,I tripled my income from helping out the disposed king of Nigeria with better emails! Thank you Claude 3.7 but I still won't renew my subscription because cursor still is better lol,0,False,25,0,0,0,,False,False,1740567889.0,2025-02-26,11.0,38.8
mewd38t,https://reddit.com/r/ClaudeAI/comments/1iykhh3/claude_37_saved_my_marriage/,,,,0,False,0,0,0,0,,True,False,0.0,,,
ktp3pe4,https://reddit.com/r/singularity/comments/1b8f5q3/claude_3_creates_a_multiplayer_application_with_a/,confused_boner,▪️AGI FELT SUBDERMALLY,Considering where we were 24 months ago...this is unbelievable,0,False,345,0,0,0,,False,False,1709773049.0,2024-03-07,0.0,75.6
ktouamh,https://reddit.com/r/singularity/comments/1b8f5q3/claude_3_creates_a_multiplayer_application_with_a/,Gaukh,,"Looking forward for AI to check its own code integrity. Especially with its vision features to check if the prompt and the output match, perhaps even do testing right along. When that is possible, Heureka.",0,False,153,0,0,0,,False,False,1709769293.0,2024-03-06,23.0,13.0
ktp89ql,https://reddit.com/r/singularity/comments/1b8f5q3/claude_3_creates_a_multiplayer_application_with_a/,gergnerd,,"I'm a web dev, and ngl this made me say ""holy shit"" out loud when he made the 2nd user and started drawing. welp...time to start figuring out where all the food banks are in my area",0,False,108,0,0,0,,False,False,1709774791.0,2024-03-07,1.0,104.7
ktosrhg,https://reddit.com/r/singularity/comments/1b8f5q3/claude_3_creates_a_multiplayer_application_with_a/,lordpermaximum,,"You can see the the working drawing app with multiplayer at the end of the video.

The prompt: ""Make a multiplayer drawing app where the strokes appear on everyone else's screens in realtime. let user pick a name and color. save users to db on login""

* Takes 2 minute 48 seconds.
* no bugs:
* users &amp; drawings persist to sqlite
* socket multiplayer

Source: [https://twitter.com/mayfer/status/1765385826496864290](https://twitter.com/mayfer/status/1765385826496864290)  
Repo of the app Claude 3 Opus created in one-go: [https://github.com/mayfer/claude-app-generator-demo](https://github.com/mayfer/claude-app-generator-demo)",0,True,90,0,0,0,,False,False,1709768722.0,2024-03-06,23.0,3.5
ktotvwx,https://reddit.com/r/singularity/comments/1b8f5q3/claude_3_creates_a_multiplayer_application_with_a/,BreadwheatInc,▪️Avid AGI feeler,"This year is going to be nuts lol. I wonder what an agent gpt-4.5 would be able to do, basically borderline AGI. I've said all these models need now that they have multimodality is a little bit more scaling, agency and improvements to reasoning and boom, you got AGI/ASI. We can already see how useful agency is. I think we're 0-4 years away from AGI.",0,False,60,0,0,0,,False,False,1709769140.0,2024-03-06,23.0,10.5
ktpbuco,https://reddit.com/r/singularity/comments/1b8f5q3/claude_3_creates_a_multiplayer_application_with_a/,lordpuddingcup,,lol and that’s counting the API overloaded/down time lol,0,False,57,0,0,0,,False,False,1709776154.0,2024-03-07,1.0,127.4
ktpmytm,https://reddit.com/r/singularity/comments/1b8f5q3/claude_3_creates_a_multiplayer_application_with_a/,[deleted],,,0,False,56,0,0,0,,True,False,1709780497.0,2024-03-07,3.0,199.8
ktp5gg5,https://reddit.com/r/singularity/comments/1b8f5q3/claude_3_creates_a_multiplayer_application_with_a/,,,,0,False,0,0,0,0,,True,False,0.0,,,
n0jbqlc,https://reddit.com/r/OpenAI/comments/1lnzg0d/anthropic_had_claude_run_an_actual_store_for_a/,AlphaTauriBootis,,"I can't find it but I read a short story (sci fi) years ago where they put an AI in charger of a fast food restaurant. It would give audio commands to employees through an earpiece. It monitored everything in the store. Quickly the store became efficient and employees were fine with not thinking at work. 

They then put the AI in charge of a big box hardware retailer. It started scheduling people's breaks apart so they wouldn't socialize. Then it started changing their walking paths through the store. Everyone stopped interacting with each other because the AI was trying to cut any wasted time whatsoever. 

Anyways, you can tell it was science fiction because the AI worked right away and didn't have a mental breakdown.",0,False,487,0,0,0,,False,False,1751265555.0,2025-06-30,6.0,75.6
n0j4c5b,https://reddit.com/r/OpenAI/comments/1lnzg0d/anthropic_had_claude_run_an_actual_store_for_a/,dino-delicious,,"Looks like it operated similarly to a real manager, making basic errors, ignoring opportunities, and hallucinating conversations.",0,False,341,0,0,0,,False,False,1751261466.0,2025-06-30,5.0,7.5
n0jymxr,https://reddit.com/r/OpenAI/comments/1lnzg0d/anthropic_had_claude_run_an_actual_store_for_a/,M4rshmall0wMan,,"The constant discounts and bad negotiation skills are interesting; I wonder if they’re a result of Constitutional AI.

All in all, it sounds like a lot of these are problems in the model’s post-training. Which is to say, they could be solved by fine-tuning a model specifically for this task.",0,False,36,0,0,0,,False,False,1751279283.0,2025-06-30,10.0,304.4
n0jqjsw,https://reddit.com/r/OpenAI/comments/1lnzg0d/anthropic_had_claude_run_an_actual_store_for_a/,,,,0,False,0,0,0,0,,True,False,0.0,,,
o3ivevh,https://reddit.com/r/singularity/comments/1qvnvid/anthropic_declared_a_plan_for_claude_to_remain/,FateOfMuffins,,"Gemini - funded by the THE ad company 

ChatGPT - the largest number of free users lighting GPUs on fire instead of being used for research

Claude - ad-free but you get like 1 query an hour

I'm just saying if you're using these things for work, you're paying them already and *that* is ad free regardless",0,False,381,0,0,0,,False,False,1770210591.0,2026-02-04,13.0,11.9
o3iuvgs,https://reddit.com/r/singularity/comments/1qvnvid/anthropic_declared_a_plan_for_claude_to_remain/,RevoDS,,I'm not sure there's a way they could have physically thrown more shade at OpenAI here,0,False,71,0,0,0,,False,False,1770210394.0,2026-02-04,13.0,8.6
o3iu0bs,https://reddit.com/r/singularity/comments/1qvnvid/anthropic_declared_a_plan_for_claude_to_remain/,ostroia,,Ok but claude has the strictest limits on the free tier. Its mostly unusable unless you have a quick question or something. So boasting youre ad-free in your products that needs payment to be usable is weird idk.,0,False,62,0,0,0,,False,False,1770210073.0,2026-02-04,13.0,3.2
o3ivjbn,https://reddit.com/r/singularity/comments/1qvnvid/anthropic_declared_a_plan_for_claude_to_remain/,BuildwithVignesh,,"**From Source:**

https://preview.redd.it/5s8ldqf29hhg1.jpeg?width=1356&amp;format=pjpg&amp;auto=webp&amp;s=5c870610bf648cd0206c5d5346fc264d7e57c063",0,True,39,0,0,0,,False,False,1770210635.0,2026-02-04,13.0,12.6
o3ix07h,https://reddit.com/r/singularity/comments/1qvnvid/anthropic_declared_a_plan_for_claude_to_remain/,,,,0,False,0,0,0,0,,True,False,0.0,,,
o9vqqs7,https://reddit.com/r/singularity/comments/1rqymbn/anthropic_recursive_self_improvement_is_here_the/,Jaun7707,,&gt;Anthropic isn’t quite there yet—human scientists still guide Claude’s progress,0,False,319,0,0,0,,False,False,1773247549.0,2026-03-11,16.0,14.2
o9vy9d1,https://reddit.com/r/singularity/comments/1rqymbn/anthropic_recursive_self_improvement_is_here_the/,Substantial-Elk4531,Rule 4 reminder to optimists,"&gt; How ridiculous. I wonder how many other models have been delayed over ""safety"" fears.

Why is this ridiculous? If 90% of the code isn't written by humans, how can you be sure it's safe unless you test it?",0,False,216,0,0,0,,False,False,1773249630.0,2026-03-11,17.0,48.9
o9vxbn6,https://reddit.com/r/singularity/comments/1rqymbn/anthropic_recursive_self_improvement_is_here_the/,Unethical_Gopher_236,,"&gt;How ridiculous. I wonder how many other models have been delayed over ""safety"" fears. Reminds us of how Sutskever said GPT-2 was too dangerous to release.

Are you upset that models are being delayed by 10 days? Why did you put safety in quotes?",0,False,153,0,0,0,,False,False,1773249368.0,2026-03-11,17.0,44.5
o9vrqoa,https://reddit.com/r/singularity/comments/1rqymbn/anthropic_recursive_self_improvement_is_here_the/,BiasHyperion784,,"It's ""A year away"" because that's the ballpark of when all their compute multiplying datacenter infrastructure starts fully coming online, by q3 of 2027 rubin will have replaced the current chips, with its even more superior successor rubin ultra beginning roll out.

None the less every training time improvement is big at this stage since incoming bespoke hardware will force multiply it.",0,False,49,0,0,0,,False,False,1773247824.0,2026-03-11,16.0,18.8
o9vtexd,https://reddit.com/r/singularity/comments/1rqymbn/anthropic_recursive_self_improvement_is_here_the/,,,,0,False,0,0,0,0,,True,False,0.0,,,
mxv2zm2,https://reddit.com/r/LocalLLaMA/comments/1lbrnod/jannano_a_4b_model_that_can_outperform_671b_on_mcp/,Kooky-Somewhere-2883,:Discord:,"**NOTICE**  
We recommend using **Q8 GGUF.**

If you are ""really tight"" on VRAM we recommend **iQ4\_XS GGUF**

These are tested! other quants like Q4\_0 and Q4\_K\_M have significantly degraded performance.",0,True,219,0,0,0,,False,False,1749964653.0,2025-06-15,5.0,53.5
mxv2rdt,https://reddit.com/r/LocalLLaMA/comments/1lbrnod/jannano_a_4b_model_that_can_outperform_671b_on_mcp/,No-Refrigerator-1672,,"So it is a Qwen 3 4B finetune, which begs me a question: do you have data on performance degradation in summarization and multilingual tasks? I'm actually running a separate vanilla Qwen3 4B as auxiliary model for non mission critial uses, and if your performance degradation is minimal, it would be tempting to replace it with your model and them use it for MCP too.",0,False,91,0,0,0,,False,False,1749964535.0,2025-06-15,5.0,51.5
mxv8aq5,https://reddit.com/r/LocalLLaMA/comments/1lbrnod/jannano_a_4b_model_that_can_outperform_671b_on_mcp/,qnixsynapse,llama.cpp,Awesome. This tiny 2.3GB model calls tools like Pro man!,0,False,46,0,0,0,,False,False,1749967423.0,2025-06-15,6.0,99.7
mxv4e7j,https://reddit.com/r/LocalLLaMA/comments/1lbrnod/jannano_a_4b_model_that_can_outperform_671b_on_mcp/,ley_haluwa,,Off topic: What app/frontend is in the video? Looks minimalistic and polished,0,False,33,0,0,0,,False,False,1749965361.0,2025-06-15,5.0,65.3
mxv9aqn,https://reddit.com/r/LocalLLaMA/comments/1lbrnod/jannano_a_4b_model_that_can_outperform_671b_on_mcp/,nguyenm,,"80% reason of why I pay for a GPT Plus subscription, and thinking of switching to Gemini Pro, is the Deep Research function. This is pretty solid for a developmental build, so keep up the good work. Although I would take a wild guess that context length would be plausible bottleneck if the search query action produces less-than-stellar results.

With the o3 Deep Research, sometimes it shows the thinking token as it can watch videos and listen to audio but I am skeptical of such. For context I was asking it if Thanos had snapped to the Adam's Family song, the original one, how much of us fleshbags would there be left. The thinking tokens mentioned it tried to watch the 1960s video of the theme song, then produced a result of 33 snaps after which there'd be 8 humans left on earth. 

Tangentially, I almost always default to Xanh SM now because of predictability in bike model and slightly-more professional drivers (due to the strictness of Vin Group management lol). ",0,False,34,0,0,0,,False,False,1749967972.0,2025-06-15,6.0,108.8
