comment_id,post_url,author,author_flair,body,depth,is_submitter,score,controversiality,gilded,total_awards,distinguished,is_deleted,is_mod_removed,created_utc,created_date,created_hour,minutes_after_post
o80e9ak,https://reddit.com/r/technology/comments/1rhoi54/claude_hits_no_1_on_app_store_as_chatgpt_users/,[deleted],,,0,False,8652,0,0,0,,True,False,1772345361.0,2026-03-01,6.0,64.6
o808vjo,https://reddit.com/r/technology/comments/1rhoi54/claude_hits_no_1_on_app_store_as_chatgpt_users/,betadonkey,,"Can’t get any better free advertising than the government insisting you are so good that it’s a national security threat if you don’t work with them.

Now everybody knows OpenAI is sloppy seconds.",0,False,3872,0,0,0,,False,False,1772342754.0,2026-03-01,5.0,21.2
o806j03,https://reddit.com/r/technology/comments/1rhoi54/claude_hits_no_1_on_app_store_as_chatgpt_users/,Sensitive_Song4219,,"Hang on aren't Anthropic tied to Palantir? Pretty shady also?

Not sure there're any true heroes here tbh",0,False,967,0,0,0,,False,False,1772341699.0,2026-03-01,5.0,3.6
o80h4db,https://reddit.com/r/technology/comments/1rhoi54/claude_hits_no_1_on_app_store_as_chatgpt_users/,CondiMesmer,,"not a huge fan of Anthropic, but they are in the morally right here. Also Claude is miles ahead of ChatGPT in every category at this point by far. 

I do like to celebrate any sort of downfall for OpenAI. They can't go out business fast enough.",0,False,787,0,0,0,,False,False,1772346830.0,2026-03-01,6.0,89.1
o806e0b,https://reddit.com/r/technology/comments/1rhoi54/claude_hits_no_1_on_app_store_as_chatgpt_users/,Ironvos,,"Maybe people should stop downloading an AI and start thinking for themselves. Things didn't get better since chatgpt got launched.

Edit: I see from replies that a lot of people are already hooked by the instant answers an AI gives you. The problem is that you have no control over where the AI gets it's information from. It's a black box where you input a statement and a new statement comes out.

Wrong answers from an AI create a feedback loop by having people copy that information and presenting at as truth on the internet, the next person looking for this information will be presented with this false information again. This can be due to an error from the AI, but can also be done intentionally for nefarious purposes by the creators of the AI.

Any info you find on the internet after the launch of chatgpt can already be compromised. And the further you go into the future the more compromised it will be. AI is basically rewriting information on the internet as we speak due to this feedback loop.",0,False,593,0,0,0,,False,False,1772341636.0,2026-03-01,5.0,2.5
o80nqrj,https://reddit.com/r/technology/comments/1rhoi54/claude_hits_no_1_on_app_store_as_chatgpt_users/,,,,0,False,0,0,0,0,,True,False,0.0,,,
nm1vbc5,https://reddit.com/r/technology/comments/1ojbymi/grieving_family_uses_ai_chatbot_to_cut_hospital/,Chaotic-Entropy,,"It's always nice to be reminded how blatantly and casually these institutions are ripping people off, with no repercussions.",0,False,11971,0,0,0,,False,False,1761762002.0,2025-10-29,18.0,10.8
nm1yvdt,https://reddit.com/r/technology/comments/1ojbymi/grieving_family_uses_ai_chatbot_to_cut_hospital/,floog,,"I have been sitting on a bill for a surgery of almost $3K for a few months now. I have repeatedly asked the provider to send me an itemized bill. It just says ""$2,800 - Dr. (his name)"" but nothing else. Is the anesthesiologist in this? Room fees? Nursing? etc. They keep saying we texted it to you as well. Yeah, a text that said I owe $2,800, send me an itemized invoice so I can make sure that this is the end of the billing. Because we both know the second I pay it I will receive two more bills 4 months after the surgery. It's a stupid game we have to play in this country for healthcare.",0,False,3514,0,0,0,,False,False,1761763011.0,2025-10-29,18.0,27.6
nm207or,https://reddit.com/r/technology/comments/1ojbymi/grieving_family_uses_ai_chatbot_to_cut_hospital/,flirtmcdudes,,Love how a “feel good” AI story is still basically just highlighting the horrors of how awful our health care is,0,False,2212,0,0,0,,False,False,1761763389.0,2025-10-29,18.0,33.9
nm1x483,https://reddit.com/r/technology/comments/1ojbymi/grieving_family_uses_ai_chatbot_to_cut_hospital/,RealLavender,,"As a 🇨🇦it's wild to see how many people have posted that the second they said ""please provide an itemized bill"" that hospitals have gone ""oh s%*t"" and the person's charge drops by 90%. No wonder people go bankrupt in the states for medical issues when you're straight up getting robbed.",0,False,1265,0,0,0,,False,False,1761762512.0,2025-10-29,18.0,19.3
nm1zkxk,https://reddit.com/r/technology/comments/1ojbymi/grieving_family_uses_ai_chatbot_to_cut_hospital/,,,,0,False,0,0,0,0,,True,False,0.0,,,
o7w9g38,https://reddit.com/r/ChatGPT/comments/1rh60py/cancel_your_chatgpt_plus_burn_their_compute_on/,AutoModerator,,"Hey /u/boomroom11,

If your post is a screenshot of a ChatGPT conversation, please reply to this message with the [conversation link](https://help.openai.com/en/articles/7925741-chatgpt-shared-links-faq) or prompt.

If your post is a DALL-E 3 image post, please reply with the prompt used to make this image.

Consider joining our [public discord server](https://discord.gg/r-chatgpt-1050422060352024636)! We have free bots with GPT-4 (with vision), image generators, and more!

 &amp;#x1F916;

Note: For any ChatGPT-related concerns, email support@openai.com - this subreddit is not part of OpenAI and is not a support channel.


*I am a bot, and this action was performed automatically. Please [contact the moderators of this subreddit](/message/compose/?to=/r/ChatGPT) if you have any questions or concerns.*",0,False,1,0,0,0,moderator,False,False,1772293912.0,2026-02-28,15.0,0.0
o7wfn5g,https://reddit.com/r/ChatGPT/comments/1rh60py/cancel_your_chatgpt_plus_burn_their_compute_on/,Whole_Succotash_2391,,"If you are switching to Claude, you can actually bring your full ChatGPT conversation history with you. Export your data first (Settings &gt; Data Controls &gt; Export Data), then run it through Memory Forge. It converts your export into a memory file you can upload to a Claude Project, so Claude has all the context from day one.

100% browser-based, your data never leaves your machine.

https://pgsgrove.com/memoryforgeland

Disclosure: I am with the team that built it.

EDIT ADDITION: An important note for switching to Claude. Claude projects has a smaller than usual memory for file uploads, so if your memory is huge you may need to create more than one project, which can be disappointing. 

Memory forge has an advanced panel that allows you to clean out unneeded chats from your memory chip file, which can help a lot. Most people have a lot of important stuff, and then a lot of random fluff.

For super huge memory loading in one go, Gemini gems and Grok deal with massive file ingestion super well so that’s an option as well. Either way, you are free to move around! You don’t have to be locked in because of memory.",0,False,3084,0,0,0,,False,False,1772295771.0,2026-02-28,16.0,31.0
o7wblf9,https://reddit.com/r/ChatGPT/comments/1rh60py/cancel_your_chatgpt_plus_burn_their_compute_on/,mookbrenner,,I'm sure the Defence contracts will more than cover the cancelled subscriptions.,0,False,394,0,0,0,,False,False,1772294555.0,2026-02-28,16.0,10.7
o7wly26,https://reddit.com/r/ChatGPT/comments/1rh60py/cancel_your_chatgpt_plus_burn_their_compute_on/,Available-Goat8727,,"Canceling is one thing, deleting your account is another.",0,False,369,0,0,0,,False,False,1772297634.0,2026-02-28,16.0,62.0
o7wb3s0,https://reddit.com/r/ChatGPT/comments/1rh60py/cancel_your_chatgpt_plus_burn_their_compute_on/,Altruistic-Radio-220,,"btw, when you delete your account, you get an automatic refund for the unused days (I deleted my account today). Seems they might have been prepared for a mass exodus today...(I'm in the EU though)",0,False,307,0,0,0,,False,False,1772294405.0,2026-02-28,16.0,8.2
o7x0yr7,https://reddit.com/r/ChatGPT/comments/1rh60py/cancel_your_chatgpt_plus_burn_their_compute_on/,PineStateWanderer,,claude is tied to peter thiel. just trading one for the other. ,0,False,208,0,0,0,,False,False,1772302180.0,2026-02-28,18.0,137.8
o7wddn8,https://reddit.com/r/ChatGPT/comments/1rh60py/cancel_your_chatgpt_plus_burn_their_compute_on/,DiamondGeeezer,,"by the way anthropic said that they oppose using their AI for autonomous weapon systems because it's not good enough yet and it would be irresponsible because of the possibility for friendly fire.

not that it's unethical, or slippery slope, just that Claude would have poor trigger discipline.

this is true but it's not exactly an ethical argument and implies they would be willing to put Claude in a drone or whatever when their AI is reliable enough



take it from Anthropic

https://www.anthropic.com/news/statement-department-of-war

&gt; Fully autonomous weapons. Partially autonomous weapons, like those used today in Ukraine, are vital to the defense of democracy. Even fully autonomous weapons (those that take humans out of the loop entirely and automate selecting and engaging targets) may prove critical for our national defense. But today, frontier AI systems are simply not reliable enough to power fully autonomous weapons. We will not knowingly provide a product that puts America’s warfighters and civilians at risk. We have offered to work directly with the Department of War on R&amp;D to improve the reliability of these systems, but they have not accepted this offer. In addition, without proper oversight, fully autonomous weapons cannot be relied upon to exercise the critical judgment that our highly trained, professional troops exhibit every day. They need to be deployed with proper guardrails, which don’t exist today.",0,False,162,0,0,0,,False,False,1772295095.0,2026-02-28,16.0,19.7
o7x1kly,https://reddit.com/r/ChatGPT/comments/1rh60py/cancel_your_chatgpt_plus_burn_their_compute_on/,,,,0,False,0,0,0,0,,True,False,0.0,,,
n14plny,https://reddit.com/r/ChatGPT/comments/1lnfcnt/after_147_failed_chatgpt_prompts_i_had_a/,AutoModerator,,"Hey /u/Prestigious-Fan118!

If your post is a screenshot of a ChatGPT conversation, please reply to this message with the [conversation link](https://help.openai.com/en/articles/7925741-chatgpt-shared-links-faq) or prompt.

If your post is a DALL-E 3 image post, please reply with the prompt used to make this image.

Consider joining our [public discord server](https://discord.gg/r-chatgpt-1050422060352024636)! We have free bots with GPT-4 (with vision), image generators, and more!

 &amp;#x1F916;

Note: For any ChatGPT-related concerns, email support@openai.com


*I am a bot, and this action was performed automatically. Please [contact the moderators of this subreddit](/message/compose/?to=/r/ChatGPT) if you have any questions or concerns.*",0,False,1,0,0,0,moderator,False,False,1751552161.0,2025-07-03,14.0,5776.8
n0f1aoi,https://reddit.com/r/ChatGPT/comments/1lnfcnt/after_147_failed_chatgpt_prompts_i_had_a/,SleekFilet,,"Umm, I just tell GPT to ask me any questions it needs until it is 95% sure it can complete the task with complete accuracy. 

Basically every starter prompt is:

You are expert

Context

Input 

Output

Plan steps before executing, accuracy &amp; completeness are vital.

Ask questions for clarity",0,False,4754,0,0,0,,False,False,1751209345.0,2025-06-29,15.0,63.2
n0fiycc,https://reddit.com/r/ChatGPT/comments/1lnfcnt/after_147_failed_chatgpt_prompts_i_had_a/,KH10304,,It’s funny to imagine 147 failed prompts rather than writing the email yourself. This is like when I spend 30 minutes rearranging my dishwasher to fit the last glass instead of using a sponge.,0,False,1035,0,0,0,,False,False,1751214962.0,2025-06-29,16.0,156.8
n0ex6qh,https://reddit.com/r/ChatGPT/comments/1lnfcnt/after_147_failed_chatgpt_prompts_i_had_a/,conndor84,,"I’d remove 2-3 clarifying questions and just leave it as a non number. Why are you limiting it?

I often write my prompt then add at the end of it ‘ask me some relevant questions to help with your response before providing’. Quality increases every time. Sometimes it’s just a few simple questions. Others it’s broken down into 3-5 themes for a few questions under each. Depends on the prompt and detail needed in the answer.",0,False,1002,0,0,0,,False,False,1751208037.0,2025-06-29,14.0,41.4
n0fekm4,https://reddit.com/r/ChatGPT/comments/1lnfcnt/after_147_failed_chatgpt_prompts_i_had_a/,Horror-Turnover6198,,"This is a solid idea, but It’s weird to act like you’ve engineered some major breakthrough and “created” something here. You’ve asked ChatGPT to ask you questions.",0,False,930,0,0,0,,False,False,1751213562.0,2025-06-29,16.0,133.5
n0f38bk,https://reddit.com/r/ChatGPT/comments/1lnfcnt/after_147_failed_chatgpt_prompts_i_had_a/,Logical-Recognition3,,"You can drop the ""You are a master-level"" whatever. Prompts like this don't add any skill or knowledge. You are just telling the LLM to role-play. 

God forbid there are people out there telling ChatGPT, ""You are an oncologist with 20 years of experience. Tell me what's going on with this weird rash.""",0,False,809,0,0,0,,False,False,1751209963.0,2025-06-29,15.0,73.5
n0fd82a,https://reddit.com/r/ChatGPT/comments/1lnfcnt/after_147_failed_chatgpt_prompts_i_had_a/,stfu__no_one_cares,,We're cooked. OP can't even respond by themselves. Every comment is copy pasta right from chatgpt. It always cracks me up when people don't think it's painfully obvious and full send the AI responses. Can't even think for themselves anymore smh,0,False,694,0,0,0,,False,False,1751213133.0,2025-06-29,16.0,126.3
n0fhsnr,https://reddit.com/r/ChatGPT/comments/1lnfcnt/after_147_failed_chatgpt_prompts_i_had_a/,NelsonQuant667,,Is this a stupid take or in the time it took you to prompt 147 times could you have written the email yourself?,0,False,652,0,0,0,,False,False,1751214589.0,2025-06-29,16.0,150.6
n0fc9rl,https://reddit.com/r/ChatGPT/comments/1lnfcnt/after_147_failed_chatgpt_prompts_i_had_a/,,,,0,False,0,0,0,0,,True,False,0.0,,,
o7xfa5v,https://reddit.com/r/technology/comments/1rhawy0/anthropics_claude_hits_no_2_on_apples_top_free/,rnilf,,"&gt; “The Leftwing nut jobs at Anthropic have made a DISASTROUS MISTAKE trying to STRONG-ARM the Department of War, and force them to obey their Terms of Service instead of our Constitution,” President Donald Trump wrote in a Friday Truth Social post.

Anthropic: ""We don't want our AI to be used to surveil American citizens and to autonomously control weapons.""

Trump (pedo): ""Leftwing nut jobs!""

A short and concise summary for those living under a rock and unaware of what's happening.

What are your principles if you either vote for MAGA, or just sit out elections entirely?",0,False,2145,0,0,0,,False,False,1772306493.0,2026-02-28,19.0,19.0
o7xer70,https://reddit.com/r/technology/comments/1rhawy0/anthropics_claude_hits_no_2_on_apples_top_free/,Ilikehotdogs1,,"Before all of this Pentagon drama, Claude was my most used AI model in my job as a network engineer. It’s fantastic and got me better results compared to Gemini 2.5 Pro and any ChatGPT trash.",0,False,1115,0,0,0,,False,False,1772306329.0,2026-02-28,19.0,16.2
o7xfey6,https://reddit.com/r/technology/comments/1rhawy0/anthropics_claude_hits_no_2_on_apples_top_free/,bloodwine,,"Their move will also more likely make it a more appealing draw for talent than OpenAI or Google.

Not only was it the right move, but it was a smart move as well.",0,False,1072,0,0,0,,False,False,1772306533.0,2026-02-28,19.0,19.6
o7xcza1,https://reddit.com/r/technology/comments/1rhawy0/anthropics_claude_hits_no_2_on_apples_top_free/,AkaAmitMishra,,Yes this AI tool is actually better than ChatGPT this is what I feel.,0,False,376,0,0,0,,False,False,1772305781.0,2026-02-28,19.0,7.1
o7xdwyl,https://reddit.com/r/technology/comments/1rhawy0/anthropics_claude_hits_no_2_on_apples_top_free/,hoopparrr759,,Who the hell is Barbara Streisand and why does she keep calling?,0,False,360,0,0,0,,False,False,1772306069.0,2026-02-28,19.0,11.9
o7xn2eb,https://reddit.com/r/technology/comments/1rhawy0/anthropics_claude_hits_no_2_on_apples_top_free/,love_glow,,I believe Sam Altman just capitulated to the department of War moments ago…,0,False,215,0,0,0,,False,False,1772308919.0,2026-02-28,20.0,59.4
o7y8ofd,https://reddit.com/r/technology/comments/1rhawy0/anthropics_claude_hits_no_2_on_apples_top_free/,,,,0,False,0,0,0,0,,True,False,0.0,,,
o8867f9,https://reddit.com/r/technology/comments/1risumw/claude_down_anthropic_ai_not_working_in_major/,Ja_Lonley,,I wonder which side took it down.,0,False,5038,0,0,0,,False,False,1772458576.0,2026-03-02,13.0,6.6
o8866nr,https://reddit.com/r/technology/comments/1risumw/claude_down_anthropic_ai_not_working_in_major/,RelampagoCero,,Still not using chatgpt anymore,0,False,2787,0,0,0,,False,False,1772458569.0,2026-03-02,13.0,6.5
o88k2nz,https://reddit.com/r/technology/comments/1risumw/claude_down_anthropic_ai_not_working_in_major/,[deleted],,,0,False,2699,0,0,0,,True,False,1772463227.0,2026-03-02,14.0,84.1
o886y61,https://reddit.com/r/technology/comments/1risumw/claude_down_anthropic_ai_not_working_in_major/,finchmast3r,,Guess lots of people cancelled chatgpt and signed up for claude first thing on this Monday morning,0,False,1382,0,0,0,,False,False,1772458842.0,2026-03-02,13.0,11.0
o8863dg,https://reddit.com/r/technology/comments/1risumw/claude_down_anthropic_ai_not_working_in_major/,corgi-king,,Probably too many people signing up like me.,0,False,841,0,0,0,,False,False,1772458536.0,2026-03-02,13.0,5.9
o8884wp,https://reddit.com/r/technology/comments/1risumw/claude_down_anthropic_ai_not_working_in_major/,,,,0,False,0,0,0,0,,True,False,0.0,,,
ml7w6fu,https://reddit.com/r/technology/comments/1jqly5u/trumps_new_tariff_math_looks_a_lot_like_chatgpts/,celtic1888,,The world economy destroyed by idiots not understanding a simple concept ,0,False,2875,0,0,0,,False,False,1743695598.0,2025-04-03,15.0,4.8
ml7w31t,https://reddit.com/r/technology/comments/1jqly5u/trumps_new_tariff_math_looks_a_lot_like_chatgpts/,Hrmbee,,"One of the key sections:

&gt;Economist James Surowiecki quickly reverse-engineered a possible explanation for the tariff pricing. He found you could recreate each of the White House’s numbers by simply taking a given country’s trade deficit with the US and dividing it by their total exports to the US. Halve that number, and you get a ready-to-use “discounted reciprocal tariff.” The White House objected to this claim and published the formula it says that it used, but as Politico points out, the formula looks like a dressed-up version of Surowiecki’s method.
&gt;
&gt;In case you weren’t sure, Surowiecki calls this approach “extraordinary nonsense.” So why did Trump’s team use it? Well, like plenty of people who’ve realized their homework is due in three hours’ time, it seems like they may have been tempted by AI.
&gt;
&gt;A number of X users have realized that if you ask ChatGPT, Gemini, Claude, or Grok for an “easy” way to solve trade deficits and put the US on “an even playing field”, they’ll give you a version of this “deficit divided by exports” formula with remarkable consistency. The Verge tested this with the phrasing used in those posts, as well as a question based more closely on the government’s language, asking chatbots for “an easy way for the US to calculate tariffs that should be imposed on other countries to balance bilateral trade deficits between the US and each of its trading partners, with the goal of driving bilateral trade deficits to zero.” All four platforms gave us the same fundamental suggestion.

Dollars to doughnuts this is what they did for most if not the whole list, which might explain some of the more nonsensical entries for various unpopulated territories. Perhaps vetting a new technology first before relying on it to formulate key public policy might be a more prudent way to go.",0,True,1931,0,0,0,,False,False,1743695570.0,2025-04-03,15.0,4.3
ml7vfoh,https://reddit.com/r/technology/comments/1jqly5u/trumps_new_tariff_math_looks_a_lot_like_chatgpts/,EconomistWithaD,,"It treats any trade deficit as equivalent.

That should expose its illiteracy right there.",0,False,592,0,0,0,,False,False,1743695381.0,2025-04-03,15.0,1.2
ml7ygqu,https://reddit.com/r/technology/comments/1jqly5u/trumps_new_tariff_math_looks_a_lot_like_chatgpts/,Asocial_Stoner,,Vibe legislating ✨,0,False,287,0,0,0,,False,False,1743696279.0,2025-04-03,16.0,16.1
ml7xegb,https://reddit.com/r/technology/comments/1jqly5u/trumps_new_tariff_math_looks_a_lot_like_chatgpts/,RangerSandi,,"Of course it is. Elon’s baby douchebags probably came up with the same idea to use AI. That’s why uninhabited islands and small territories/protectorates with no U.S. trade have a minimum 10% tariff. (See Diego Garcia, Heard &amp; McDonald Islands &amp; more.) 

It’s a wonder they didn’t tariff Puerto Rico while they were at it. Sheer stupidity!",0,False,222,0,0,0,,False,False,1743695959.0,2025-04-03,15.0,10.8
ml80q1u,https://reddit.com/r/technology/comments/1jqly5u/trumps_new_tariff_math_looks_a_lot_like_chatgpts/,,,,0,False,0,0,0,0,,True,False,0.0,,,
jf6c6jp,https://reddit.com/r/ChatGPT/comments/12diapw/gpt4_week_3_chatbots_are_yesterdays_news_ai/,AutoModerator,,"We kindly ask /u/lostlifon to respond to this comment with the prompt they used to generate the output in this post. This will allow others to try it out and prevent repeated questions about the prompt.

^(Ignore this comment if your post doesn't have a prompt.)

***While you're here, we have a [public discord server](https://discord.gg/NuefU36EC2). We have a free Chatgpt bot, Open Assistant bot (Open-source model), AI image generator bot, GPT-4 bot, Perplexity AI bot.***

####[So why not join us?](https://discord.gg/r-chatgpt-1050422060352024636)

PSA: For any Chatgpt-related issues email support@openai.com. 
####[ChatGPT Plus Giveaway](https://www.reddit.com/r/ChatGPT/comments/127p9cx/chatgpt_plus_subscription_giveaway_worlds_1st/) | [Prompt engineering hackathon](https://www.flowgpt.com/hackathon)


*I am a bot, and this action was performed automatically. Please [contact the moderators of this subreddit](/message/compose/?to=/r/ChatGPT) if you have any questions or concerns.*",0,False,1,0,1,0,moderator,False,False,1680783039.0,2023-04-06,12.0,0.0
jf6lba6,https://reddit.com/r/ChatGPT/comments/12diapw/gpt4_week_3_chatbots_are_yesterdays_news_ai/,[deleted],,"**tldr;** 

stuff happening faster than you can read up on what stuff is happening.",0,False,3007,0,0,0,,False,False,1680787630.0,2023-04-06,13.0,76.5
jf6gma1,https://reddit.com/r/ChatGPT/comments/12diapw/gpt4_week_3_chatbots_are_yesterdays_news_ai/,scofieldr,,I'm starting to get fomo,0,False,907,0,0,0,,False,False,1680785391.0,2023-04-06,12.0,39.2
jf6jwo3,https://reddit.com/r/ChatGPT/comments/12diapw/gpt4_week_3_chatbots_are_yesterdays_news_ai/,[deleted],,,0,False,631,0,0,0,,True,False,1680786977.0,2023-04-06,13.0,65.6
jf6h48s,https://reddit.com/r/ChatGPT/comments/12diapw/gpt4_week_3_chatbots_are_yesterdays_news_ai/,cambrian-implosion,,This shit is legit blowing my mind. Advancements are being made so fast it's becoming impossible to keep up with everything. A year from now I don't know what I'll do,0,False,572,0,0,0,,False,False,1680785635.0,2023-04-06,12.0,43.3
jf6k2hu,https://reddit.com/r/ChatGPT/comments/12diapw/gpt4_week_3_chatbots_are_yesterdays_news_ai/,basafish,,Thanks for compiling all of this. Now I have some things to play with for my next jobless 4 years. Much appreciated.,0,False,391,0,0,0,,False,False,1680787053.0,2023-04-06,13.0,66.9
jf6iucv,https://reddit.com/r/ChatGPT/comments/12diapw/gpt4_week_3_chatbots_are_yesterdays_news_ai/,,,,0,False,0,0,0,0,,True,False,0.0,,,
odor0d0,https://reddit.com/r/technology/comments/1s9jljp/anthropic_issues_copyright_takedown_requests_to/,thetechguyv,,Now they are worried about copyright lol. ,0,False,8771,0,0,0,,False,False,1775048449.0,2026-04-01,13.0,11.8
odot0k4,https://reddit.com/r/technology/comments/1s9jljp/anthropic_issues_copyright_takedown_requests_to/,Dr_CrayonEater,,"Hey look, the company that did around $1.5 billion worth of copyright violations in book piracy has suddenly decided copyright matters...",0,False,3574,0,0,0,,False,False,1775049083.0,2026-04-01,13.0,22.4
odotkjt,https://reddit.com/r/technology/comments/1s9jljp/anthropic_issues_copyright_takedown_requests_to/,RedPandaExplorer,,Owners of plagiarism machine mad that schematics of their machine were plagiarized,0,False,1717,0,0,0,,False,False,1775049257.0,2026-04-01,13.0,25.3
odosau6,https://reddit.com/r/technology/comments/1s9jljp/anthropic_issues_copyright_takedown_requests_to/,tongizilator,,Good luck with that. ,0,False,957,0,0,0,,False,False,1775048860.0,2026-04-01,13.0,18.7
odososc,https://reddit.com/r/technology/comments/1s9jljp/anthropic_issues_copyright_takedown_requests_to/,SlaterVBenedict,,"Feels bad when it happens to you, doesn’t it Anthropic?",0,False,516,0,0,0,,False,False,1775048981.0,2026-04-01,13.0,20.7
odosmko,https://reddit.com/r/technology/comments/1s9jljp/anthropic_issues_copyright_takedown_requests_to/,,,,0,False,0,0,0,0,,True,False,0.0,,,
o91yu5a,https://reddit.com/r/technology/comments/1rmswfp/by_bullying_anthropic_the_pentagon_is_violating/,Crim91,,"Our government is bullying EVERYONE. They're Fascist.

The sane among us are still waiting for their consequences to materialize...",0,False,751,0,0,0,,False,False,1772839295.0,2026-03-06,23.0,27.4
